text,crowd_label,conf0,conf1,conf2
Mortgage Lender Charged With Defrauding Government: (Reuters) - The United States on Thursday ... http://t.co/yZKis36pfl #Citigroup #BRK,0,1.0,0.0,0.0
U.S. charges N.Y. mortgage lender with defrauding government: [Reuters] - The United States on... http://t.co/8lbgIfVU6G #Citigroup #BRK,0,1.0,0.0,0.0
The Man And Citigroup Loan Behind New York's Corruption Scandal:  http://t.co/APuaIJSVwE #Citigroup #BRK,0,1.0,0.0,0.0
"Bond Traders Club Loses Cachet in Most Important Market: [at Bloomberg] - Primary dealers, the... http://t.co/8637UYfCtI #Citigroup #BRK",0,1.0,0.0,0.0
"U.S.: With Support from Citi, ChicagoÛªs Urban Prep Academies to Expand Project GOLD and Improv... http://t.co/3ZNbTlFHcc #Citigroup #BRK",0,1.0,0.0,0.0
"Exclusive - TPG, Madison Dearborn final bidders for NFP: sources:  http://t.co/MODX1gIIA8 #Citigroup #BRK",0,1.0,0.0,0.0
Better Buy Right Now: Citigroup or JPMorgan Chase?:  http://t.co/ME1xqCacAE #Citigroup #BRK,0,1.0,0.0,0.0
Witness at the Center of Malcolm Smith Bribery Case Owes $126M to Citigroup: The cooperating w... http://t.co/NQcyDwmFTl #Citigroup #BRK,0,1.0,0.0,0.0
Australia: Citibank to Sponsor The Good Food &amp  Wine Show 2013 in Melbourne and Sydney: [at noo... http://t.co/JBUqOmyhp7 #Citigroup #BRK,0,1.0,0.0,0.0
Taiwan: Second Citi Future Leaders Development Program Awards Ceremony: [at noodls] - For Imme... http://t.co/e0Ukj0zK2v #Citigroup #BRK,0,1.0,0.0,0.0
This Banking Giant is Undervalued: Adnan is a member of The Motley Fool Blog Network -- entrie... http://t.co/wzQB784dRJ #Citigroup #BRK,0,1.0,0.0,0.0
Standard Chartered Says U.A.E. Consumer Loans Jumped 20% in 2012:  http://t.co/ie9P0Yzdwc #Citigroup #BRK,0,1.0,0.0,0.0
A fiscal warning from two former budget chiefs: Two former budget chiefs who worked for presid... http://t.co/nMraWaP2hP #Citigroup #BRK,0,1.0,0.0,0.0
Judge questions fairness of Citigroup $590 million settlement over toxic mortgage assets: Bott... http://t.co/kfcV1chDEg #Citigroup #BRK,0,1.0,0.0,0.0
A fiscal warning from two former budget chiefs: [Reuters] - Two former budget chiefs who worke... http://t.co/pIjoPGAfUi #Citigroup #BRK,0,1.0,0.0,0.0
Judge questions fairness of Citigroup $590 million settlement: A Manhattan federal judge on Mo... http://t.co/sqrY52bNfg #Citigroup #BRK,0,1.0,0.0,0.0
Judge questions fairness of Citigroup $590 million settlement: ROB Insight is The Globe and Ma... http://t.co/l02N15ptlp #Citigroup #BRK,0,1.0,0.0,0.0
Judge questions fairness of Citigroup $590 million settlement:  http://t.co/dXDhVF1Z7T #Citigroup #BRK,0,0.6731,0.16344999999999998,0.16344999999999998
Judge questions fairness of Citigroup $590 million settlement: [Reuters] - A Manhattan federal... http://t.co/PEvDP9Y5II #Citigroup #BRK,0,1.0,0.0,0.0
Judge questions fairness of Citigroup $590 million settlement: By Jonathan Stempel (Reuters) -... http://t.co/3DAZKow8FI #Citigroup #BRK,0,1.0,0.0,0.0
Vivendi Wins Copyright Ruling in Used-Digital-Song Case:  http://t.co/AXdkP6S6tq #Citigroup #BRK,0,1.0,0.0,0.0
"Fighting_to_save_our_community_banks0_1364587394.jpg: All over Georgia, community banks have clo... http://t.co/jt6VkN8cN7 #Citigroup #BRK",0,1.0,0.0,0.0
15 Reasons to Invest in Bank Stocks Right Now:  http://t.co/xQ4HqiCKPa #Citigroup #BRK,1,0.16920000000000002,0.6616,0.16920000000000002
Energy security and American jobs: President Barack Obama has a big decision to make about thi... http://t.co/YZ906ScWnn #Citigroup #BRK,0,1.0,0.0,0.0
BlackRock To Hire Tim Geithner ?: Fox Business Network reports that the former Treasury Secret... http://t.co/q4dtlstlUn #Citigroup #BRK,0,1.0,0.0,0.0
[$$] Citi Sails Back Into 'Synthetic' Securities:  http://t.co/Tz5DxgQZXz #Citigroup #BRK,0,1.0,0.0,0.0
"With Support from Citi, ChicagoÛªs Urban Prep Academies to Expand Project GOLD and Improve Grad... http://t.co/MLLZ2B97l2 #Citigroup #BRK",0,1.0,0.0,0.0
"Steve Currall:  Leadership Lessons: What Do Executives at Amazon, Citigroup and Whole Foods Ma... http://t.co/40utwn6EJZ #Citigroup #BRK",0,0.6496,0.17520000000000002,0.17520000000000002
[video] NYC Job Fair for Veterans:  http://t.co/IehxYn7yrO #Citigroup #BRK,0,0.6662,0.1669,0.1669
China's CITIC Securities taps Goldman model to hedge on global future: [Reuters - UK Focus] - ... http://t.co/EcpIooYQFW #Citigroup #BRK,0,1.0,0.0,0.0
Federal Reserve orders Citigroup to improve money laundering checks: Bottom Right Default Stat... http://t.co/qLzHOh2d5k #Citigroup #BRK,0,1.0,0.0,0.0
FacebookÛªs Empire is Growing and 2 Other Heavily Traded Stocks:  http://t.co/l5dPif9mTa #Citigroup #BRK,0,1.0,0.0,0.0
Citigroup's Capital X 6.10% Capital Securities Yield Pushes Past 6%:  http://t.co/VxyiLqgJMn #Citigroup #BRK,0,1.0,0.0,0.0
"Federal Reserve tells Citigroup to improve plans for preventing money laundering: NEW YORK, N.... http://t.co/vOiVMngk1u #Citigroup #BRK",0,1.0,0.0,0.0
5 New Preferreds To Replace Recently Called Securities:  http://t.co/CprjFjGFDo #Citigroup #BRK,1,0.16344999999999998,0.6731,0.16344999999999998
Companies To Employees: Get Healthier Or There'll Be 'Consequences': Most companies plan to cr... http://t.co/GQHm9Mi2zG #Citigroup #BRK,0,1.0,0.0,0.0
FSA to keep banks' Libor setting voluntary for now:  http://t.co/Ctw0ICgiuo #Citigroup #BRK,0,1.0,0.0,0.0
U.S. Hedge Funds Swoop on Traders at Struggling Europe Startups: U.S. hedge funds Pine River C... http://t.co/JWvQUbNn0t #Citigroup #BRK,0,1.0,0.0,0.0
Exclusive: BofA's Moynihan to hold stock longer in new pay policy: [Reuters] - Bank of America... http://t.co/2RGJCpul4f #Citigroup #BRK,0,1.0,0.0,0.0
JPM: From Safest to the New Bad Bank:  http://t.co/r06mf7xMFP #Citigroup #BRK,0,1.0,0.0,0.0
DOJ Criminal Probe Into JPMorgan Whale Trade At 'Advanced Stages': Report: CNBC is reporting t... http://t.co/tY4swTZj6O #Citigroup #BRK,0,1.0,0.0,0.0
Wall Street bonuses projected to rise 15 percent this year: consultant:  http://t.co/8t8gpKjntO #Citigroup #BRK,0,1.0,0.0,0.0
Wall Street bonuses projected to rise 15 pct this year -consultant:  http://t.co/wDwkhwvgVM #Citigroup #BRK,0,1.0,0.0,0.0
Exclusive: Fed pushes banks to ignore rivals when setting bonuses: The Federal Reserve is push... http://t.co/JWG4d9EhN4 #Citigroup #BRK,0,1.0,0.0,0.0
Cash Dividend On The Way From Citigroup's Capital XVI 6.45% Preferred Securities:  http://t.co/G8zc0CZlGd #Citigroup #BRK,0,1.0,0.0,0.0
Citigroup Said to Plan Three-Year Benchmark Securities Offering:  http://t.co/Erpocz5LGR #Citigroup #BRK,0,1.0,0.0,0.0
Citadel's Griffin to leave E*Trade board: E*Trade Financial Corp. said Friday that Citadel LLC... http://t.co/Mh7aVHlu5U #Citigroup #BRK,0,1.0,0.0,0.0
[$$] A Safe Bet on Big Banks:  http://t.co/uGuUnMwSzM #Citigroup #BRK,0,1.0,0.0,0.0
"Wall Street CEOs Get Bonuses, Perks to Take Government Jobs: [The Daily Ticker] - http://d.yim... http://t.co/ep3AvAKAl6 #Citigroup #BRK",0,1.0,0.0,0.0
Royal Bank of Canada Chief Executive Officer Gordon Nixon: Nixon was awarded C$12.6 million in... http://t.co/SGFNEkg99X #Citigroup #BRK,0,1.0,0.0,0.0
Fitch Affirms Citigroup Commercial Mortgage Securities Inc. Series 2005-EMG: Fitch Ratings has... http://t.co/FjA5vUDu5c #Citigroup #BRK,0,1.0,0.0,0.0
Ex-Div Reminder for Citigroup's Capital XI 6.00% Securities:  http://t.co/LsghtczEpP #Citigroup #BRK,0,1.0,0.0,0.0
Finland calls for 3.5 bln euro investment in electricity networks:  http://t.co/lV7LyacyOw #Citigroup #BRK,0,1.0,0.0,0.0
"Late winter storm sends snow, sleet to New England: Syria's government accused rebels of firin... http://t.co/4Gk1a7cqvX #Citigroup #BRK",0,1.0,0.0,0.0
Citigroup to pay $730 million to settle lawsuit: Anti-smoking advocates and health experts are... http://t.co/D8NS9dzTPt #Citigroup #BRK,0,1.0,0.0,0.0
Citigroup downgrades Sun TV  shares fall: Reuters Market Eye - Shares in Sun TV Network Ltd fa... http://t.co/sOv3Qf3M67 #Citigroup #BRK,0,1.0,0.0,0.0
Update on the latest business: Stocks are slumping on Wall Street as traders worry that a prop... http://t.co/UuLGSCnIny #Citigroup #BRK,0,0.6634,0.1683,0.1683
ÛÏVirtual Counselor NetworkÛ Transforms Professional Housing Counseling for Low-to-Moderate Inc... http://t.co/1QzQSl80Hh #Citigroup #BRK,0,1.0,0.0,0.0
"Symantec, Intel, Security Stocks Boosted By Attacks:  http://t.co/DTcsTpZ3xC #Citigroup #BRK",0,1.0,0.0,0.0
Foreclosure Activity Trends Down:  http://t.co/rTp8RCHYrJ #Citigroup #BRK,0,1.0,0.0,0.0
Is Citigroup Headed in the Right Direction?:  http://t.co/VJpHMJP40w #Citigroup #BRK,0,1.0,0.0,0.0
Citigroup Announces $3 Billion Redemption of Trust Preferred Securities: The redemption date f... http://t.co/AWEVPBzmRd #Citigroup #BRK,0,1.0,0.0,0.0
Citigroup Announces $3 Billion Redemption of Trust Preferred Securities: [Business Wire] - Cit... http://t.co/1MD2HqmRdC #Citigroup #BRK,0,1.0,0.0,0.0
"Citigroup pays new CEO Corbat $12.4M in 2012: NEW YORK (AP) ÛÓ Citigroup awarded its new CEO, M... http://t.co/oxC2Lke5o1 #Citigroup #BRK",0,1.0,0.0,0.0
"Citigroup awarded its new CEO, Michael Corbat, a total of $12.4 million last year: NEW YORK, N... http://t.co/EUvLlRTdFk #Citigroup #BRK",0,1.0,0.0,0.0
Is Citi Really the Safest Bank?:  http://t.co/702j1WtdN9 #Citigroup #BRK,0,1.0,0.0,0.0
Seeking Opportunity: 10 Stocks To Watch Right Now:  http://t.co/2jAgN2PIrW #Citigroup #BRK,1,0.0,1.0,0.0
"[video] Banks' Balance Sheets 'Healthy': Analyst: [at CNBC] - Jason Goldberg, Barclays analyst... http://t.co/6BarTv6Uev #Citigroup #BRK",0,0.6809,0.15955000000000003,0.15955000000000003
J.P. Morgan in government cross hairs:  http://t.co/SY222ljCiy #Citigroup #BRK,0,1.0,0.0,0.0
[video] Banks Getting Healthier Every Year: S and P:  http://t.co/OncoLn013P #Citigroup #BRK,0,1.0,0.0,0.0
"The Federal Reserve, Bank of America, and Wells Fargo: What You Need to Know Right Now:  http://t.co/mNrhyaQFCm #Citigroup #BRK",1,0.17154999999999998,0.6569,0.17154999999999998
E*Trade stock falls 8 pct on sale by biggest shareholder:  http://t.co/unnodKxnPE #Citigroup #BRK,0,1.0,0.0,0.0
Trade Group Formed With BofA After Securitization Rival Exodus:  http://t.co/21Rfmhv4pE #Citigroup #BRK,0,1.0,0.0,0.0
Ken Griffin's E-Trade Move: Billionaire's Citadel To Sell As Stock Hits 52-Week High:  http://t.co/nBUOlZseqs #Citigroup #BRK,0,1.0,0.0,0.0
"Citigroup, Wells Fargo Reach Clawback Deal With New York: Employees responsible for serious fi... http://t.co/N0dJ7Pc5ef #Citigroup #BRK",0,1.0,0.0,0.0
Sun Communities Makes Offering:  http://t.co/16SPADzCc0 #Citigroup #BRK,0,1.0,0.0,0.0
"Citadel to sell its 9.6% stake in E-Trade, Reuters reports:  http://t.co/wU7yGSCccN #Citigroup #BRK",0,1.0,0.0,0.0
"Citadel to sell its remaining stake in E*Trade: Citadel LLC, the largest investor in E*Trade F... http://t.co/hpwcllDIPn #Citigroup #BRK",0,1.0,0.0,0.0
4 Reasons To Buy General Electric Right Now:  http://t.co/SQQpMN9pkT #Citigroup #BRK,1,0.16785,0.6643,0.16785
A Responsible Bank for the Long Term: [at Motley Fool] - While big banks like Citigroup and Ba... http://t.co/s9hQgeKxYn #Citigroup #BRK,0,1.0,0.0,0.0
UPDATE 1-Citadel to sell its remaining stake in E*Trade:  http://t.co/nJo8JzW2bI #Citigroup #BRK,0,1.0,0.0,0.0
Citadel to sell its remaining stake in E*Trade:  http://t.co/CYs5DmjREE #Citigroup #BRK,0,1.0,0.0,0.0
Mission Asset Fund to Launch Security Deposit Loan Program for Underbanked with Support from C... http://t.co/AoQLRqvNru #Citigroup #BRK,0,1.0,0.0,0.0
Second Circuit Rules That Putative Auction Rate Securities Class...: In Mayor and City Council... http://t.co/DcvhyOuys6 #Citigroup #BRK,0,1.0,0.0,0.0
Aggressive global loan expansion by China Development Bank: Ten years on from the outbreak tha... http://t.co/k8iJ323BWb #Citigroup #BRK,0,1.0,0.0,0.0
New York Community Bancorp: M&amp A Rumor Winner:  http://t.co/Cne7umaWfc #Citigroup #BRK,0,1.0,0.0,0.0
MicrosoftÛªs Skype Under Investigation and 2 Other Heavily Traded Stocks:  http://t.co/f3ifEB9per #Citigroup #BRK,0,1.0,0.0,0.0
Mission Asset Fund to Launch Security Deposit Loan Program for Underbanked with Support from C... http://t.co/W9PoQdCAxK #Citigroup #BRK,0,1.0,0.0,0.0
"Affordable lender CPC gets $250M Citigroup boost: Community Preservation Corporation, a strugg... http://t.co/kOzYxEFCkx #Citigroup #BRK",0,1.0,0.0,0.0
"U.S. Stocks Rise as S&amp P 500 Approaches Record, Volatility Slips: The Standard &amp  Poor's 500 Ind... http://t.co/2YgjZ6kC7n #Citigroup #BRK",0,1.0,0.0,0.0
Government sold almost $490M of GM stock in Feb:  http://t.co/m7uaoQ7oiT #Citigroup #BRK,0,1.0,0.0,0.0
BlackBerry Prepares For Big Launch and 3 Other Heavily Traded Stocks:  http://t.co/CiBFIhRR5q #Citigroup #BRK,0,1.0,0.0,0.0
[video] FMHR's Top Three Trades:  http://t.co/s7AgDgH6Bm #Citigroup #BRK,0,0.6639,0.16804999999999998,0.16804999999999998
Ex-Citi Trader: I Learned More In One Year Of Photographing...: Former Citigroup forex trader ... http://t.co/HwrhXbTer8 #Citigroup #BRK,0,1.0,0.0,0.0
Exclusive Interview With Former AIG CEO Hank Greenberg: Black Boxes and Too Big to Fail:  http://t.co/vZZgqj61vv #Citigroup #BRK,0,1.0,0.0,0.0
Futures Trade Flat After Record Gains:  http://t.co/U3GI3GhWDO #Citigroup #BRK,0,1.0,0.0,0.0
Is Citi safer than JPMorgan?: The newest stress tests for US banks produced scores that are at... http://t.co/0ZcNGmsMpj #Citigroup #BRK,0,0.6668,0.16660000000000003,0.16660000000000003
Analysis: S&amp P paper trail may lead nowhere in government case:  http://t.co/Bxz2x52Nwi #Citigroup #BRK,0,1.0,0.0,0.0
"Analysis: S&amp P paper trail may lead nowhere in government case: [Reuters] - In early 2007, as s... http://t.co/7dGVT47Mqp #Citigroup #BRK",0,1.0,0.0,0.0
15 Reasons Bank of America Is a Buy Right Now: [at Motley Fool] - Over a dozen reasons the big... http://t.co/n8DjLxp666 #Citigroup #BRK,0,0.6639,0.16804999999999998,0.16804999999999998
Dubai lender ENBD eyes bond sale to repay government funds: sources:  http://t.co/nix9BEiXmN #Citigroup #BRK,0,1.0,0.0,0.0
Is Citi safer than JPMorgan? And other stress-test questions:  http://t.co/5i5hYbzVmL #Citigroup #BRK,1,0.16775,0.6645,0.16775
Analysis: Is Citi safer than JPMorgan? And ...: The newest stress tests for U.S. banks produce... http://t.co/sAr7TXSW6k #Citigroup #BRK,0,1.0,0.0,0.0
Citigroup's Capital XV Trust Preferred Securities Ex-Dividend Reminder - 3/12/13:  http://t.co/MmG8CLDue5 #Citigroup #BRK,0,1.0,0.0,0.0
UPDATE 1-Denizbank in exclusive talks on Citi's Turkish unit-sources:  http://t.co/Z4FO8b1RzZ #Citigroup #BRK,0,1.0,0.0,0.0
Major U.S. banks pass Fed's health test:  http://t.co/NMVzFlLhpi #Citigroup #BRK,0,1.0,0.0,0.0
Citi Plays It Safe After Last Year's Embarrassing Fed Rejection:  http://t.co/Pn1PDKfhu2 #Citigroup #BRK,0,1.0,0.0,0.0
Citigroup above Fed standard in stress test:  http://t.co/Q2rKnRudzE #Citigroup #BRK,0,1.0,0.0,0.0
"Exclusive: Hedge fund Portman Square scales back, CEO steps down:  http://t.co/L8UiwCj5oh #Citigroup #BRK",0,1.0,0.0,0.0
"Exclusive: Hedge fund Portman Square scales back, CEO steps down - sources: The chief executiv... http://t.co/IKvC78LjrG #Citigroup #BRK",0,1.0,0.0,0.0
Texas Banks in Better Position Than Most U.S. Community Banks: Strong Texas Economy Never Fell... http://t.co/kw4VW8Ena7 #Citigroup #BRK,0,1.0,0.0,0.0
"Exclusive: Hedge fund Portman Square scales back, CEO steps down - sources:  http://t.co/652RkFJ7kQ #Citigroup #BRK",0,1.0,0.0,0.0
"Exclusive - Hedge fund Portman Square scales back, CEO steps down: sources:  http://t.co/cE0BJrUSBc #Citigroup #BRK",0,1.0,0.0,0.0
Will Citigroup Return to Its Former Glory?: Binu is a member of The Motley Fool Blog Network -... http://t.co/nWEXGbkeAW #Citigroup #BRK,0,1.0,0.0,0.0
Citi on right strategic path ÛÓ Corbat:  http://t.co/WzJy9mRTg3 #Citigroup #BRK,0,1.0,0.0,0.0
"Banks, traders wary of two-step stress test:  http://t.co/BeZ8Oh86V9 #Citigroup #BRK",0,1.0,0.0,0.0
Excess Capital Encourages M&amp A Activity with More Buyers than Sellers  Smaller Banks More Likel... http://t.co/iF4mbIGH0Z #Citigroup #BRK,0,1.0,0.0,0.0
Citi's strategy remains the right one: Corbat:  http://t.co/pCda2ioJua #Citigroup #BRK,0,1.0,0.0,0.0
Citigroup agrees to buy back securities from Hawaii ahead of schedule: Citigroup Inc. has agre... http://t.co/waGRsIZLE2 #Citigroup #BRK,0,1.0,0.0,0.0
Citigroup agrees to buy back securities from Hawaii ahead of schedule:  http://t.co/Ftmb6b0zbD #Citigroup #BRK,0,1.0,0.0,0.0
"Topaz Exchange, EU Pension Trades, Borg: Compliance:  http://t.co/FdjGuyyXnv #Citigroup #BRK",0,1.0,0.0,0.0
[video] Should Government Cap Bankers' Bonuses?:  http://t.co/gHvUPfXl1Q #Citigroup #BRK,0,0.6577,0.17115000000000002,0.17115000000000002
Securitization Lobby in Disarray After Most Directors Quit: The American Securitization Forum ... http://t.co/IaEfqHyhcq #Citigroup #BRK,0,1.0,0.0,0.0
Exclusive - Goldman eyes Volcker workaround for buyouts:  http://t.co/Wd9tMGEdwX #Citigroup #BRK,0,1.0,0.0,0.0
Exclusive: Goldman eyes Volcker workaround for buyouts:  http://t.co/E8dLpRQIJw #Citigroup #BRK,0,1.0,0.0,0.0
Securitization Lobby in Disarray After Most Directors Quit:  http://t.co/GWhvWldHZ2 #Citigroup #BRK,0,1.0,0.0,0.0
"Goldman, Citi Warn Shareholders on Cybersecurity:  http://t.co/o7BIHHLhlA #Citigroup #BRK",0,1.0,0.0,0.0
The World's Richest Billionaire Hedge Fund Managers And Traders:  http://t.co/LRQp8l5j69 #Citigroup #BRK,0,1.0,0.0,0.0
The GOP warms to marriage equality: Only one Republican voted for the same-sex marriage bill t... http://t.co/FQZ5H17JVA #Citigroup #BRK,0,1.0,0.0,0.0
Jack Lew and Citigroup: How the Corrupt Rich Get Richer with Cronyism: The rest of us suffered... http://t.co/QEGIO3M9JL #Citigroup #BRK,0,1.0,0.0,0.0
Bertelsmann to Buy Full Ownership of BMG Rights From KKR:  http://t.co/Cegd2a7VtW #Citigroup #BRK,0,1.0,0.0,0.0
"Citigroup and Blackstone's Capital Requirement Workaround: [at CNBC] - A year ago, Citi bought... http://t.co/b3A431eGxw #Citigroup #BRK",0,1.0,0.0,0.0
Fed Governor Raskin Says Bank Reputations Harmed by Bailouts:  http://t.co/laNsGncMMp #Citigroup #BRK,0,1.0,0.0,0.0
"Treasury Pick Tries to Cast His History as Right for the Job: Jacob Lew, who faces a Senate pa... http://t.co/KXfFcgT2vX #Citigroup #BRK",0,1.0,0.0,0.0
"Final Trade: Your First Move for Thursday, Feb. 28:  http://t.co/mtO7KdASXt #Citigroup #BRK",0,0.6747,0.16265000000000002,0.16265000000000002
1 Metric Bank of America Investors Can Rightly Celebrate:  http://t.co/m0cmBO2mNs #Citigroup #BRK,0,1.0,0.0,0.0
JPMorgan's Projections Underline Just How Cheap the Stock Is:  http://t.co/tSNftFlxKb #Citigroup #BRK,0,1.0,0.0,0.0
Boarding Taylor Morrison's Maiden Flight: Arturo is a member of The Motley Fool Blog Network -... http://t.co/YUJqSzja4Q #Citigroup #BRK,0,1.0,0.0,0.0
The 40 Highest-Earning Hedge Fund Managers And Traders:  http://t.co/YEfNKtjxE6 #Citigroup #BRK,0,1.0,0.0,0.0
Exclusive - Goldman to begin fresh round of job cuts: sources:  http://t.co/uEb2KLLPXs #Citigroup #BRK,0,1.0,0.0,0.0
Exclusive - Goldman to begin fresh round of job cuts: sources:  http://t.co/TOgShNV7co #Citigroup #BRK,0,1.0,0.0,0.0
Exclusive: Goldman to begin fresh round of job cuts:  http://t.co/H29QNcWOft #Citigroup #BRK,0,1.0,0.0,0.0
Dynasty adds adviser team working with pro athletes:  http://t.co/4cbmG9xbhK #Citigroup #BRK,0,1.0,0.0,0.0
Dynasty adds adviser team working with pro athletes:  http://t.co/f1mojTbXBl #Citigroup #BRK,0,1.0,0.0,0.0
Exclusive: Goldman to begin fresh round of job cuts - sources:  http://t.co/abTvz6kzYt #Citigroup #BRK,0,0.6731,0.16344999999999998,0.16344999999999998
Exclusive - Goldman to begin fresh round of job cuts : sources:  http://t.co/NCsn80gkKZ #Citigroup #BRK,0,1.0,0.0,0.0
"Citigroup: Optimism Everywhere, Are They Right?:  http://t.co/1EEqfeBye6 #Citigroup #BRK",0,1.0,0.0,0.0
Banks Looking for 'Right Thing' on CEO Pay: Krawcheck: Succession Planning for Business Owners... http://t.co/TZGPWad2YK #Citigroup #BRK,0,1.0,0.0,0.0
Citigroup Awards Corbat $11.5M Compensation Deal:  http://t.co/H2JXclaCVB #Citigroup #BRK,0,1.0,0.0,0.0
Edwards Lifesciences to Present at the Citigroup and RBC 2013 Global Healthcare Conferences: M... http://t.co/FXDi2SAsml #Citigroup #BRK,0,1.0,0.0,0.0
"Emeli Sande, Mumford &amp  Sons Lead Winners at Brit Awards:  http://t.co/NG1VZYvgsf #Citigroup #BRK",0,1.0,0.0,0.0
Limited Mortgage Finance Role for U.S. Government Gains Support:  http://t.co/drV92iu2 #Citigroup #BRK,0,1.0,0.0,0.0
"Whole Foods, Citigroup CEOs set for talks on campus: Two sometimes-controversial business giants... http://t.co/dZTh6YgH #Citigroup #BRK",0,1.0,0.0,0.0
"Dubai utility DEWA eyes $1 bln sukuk to repay debt, fund projects:  http://t.co/EgAUFqai #Citigroup #BRK",0,1.0,0.0,0.0
"Gilt Groupe's Kevin Ryan: What Works, And Doesn't Work, in Flash Sales: The online retail pionee... http://t.co/DScHqikn #Citigroup #BRK",0,1.0,0.0,0.0
US investment banks embrace riskier block trades:  http://t.co/WCiojMyF #Citigroup #BRK,0,1.0,0.0,0.0
US investment banks embrace riskier block trades:  http://t.co/3fqg94ye #Citigroup #BRK,0,1.0,0.0,0.0
Tracking Bruce Berkowitz's Fairholme Portfolio - Q4 2012 Update:  http://t.co/YwrTl466 #Citigroup #BRK,0,1.0,0.0,0.0
[video] Opinion: Are Too Big to Fail Banks Really Safe?:  http://t.co/7XW14TVY #Citigroup #BRK,1,0.1683,0.6634,0.1683
"Citigroup Lost $15 Million With UBS's - Crap' CDO Blessed by S&amp P: In just six months, Standard &amp ... http://t.co/yktZNvZg #Citigroup #BRK",0,1.0,0.0,0.0
This Is What Will Boost Your Bank Stock Right Now:  http://t.co/hu9mDNIb #Citigroup #BRK,0,1.0,0.0,0.0
"Saba Said to Hire Citigroup Trader Roberts, RBC's Kazarian: Gabriel Roberts, who led global cred... http://t.co/4K4O8gM6 #Citigroup #BRK",0,1.0,0.0,0.0
Ward Off Big Government With Shareholder Activism: Analyst:  http://t.co/1PT5i8Hg #Citigroup #BRK,0,1.0,0.0,0.0
"Saba Said to Hire Citigroup Trader Roberts, RBCÛªs Kazarian:  http://t.co/GWdk8gEI #Citigroup #BRK",0,1.0,0.0,0.0
[video] Traders Highly Selective Amid Financial Sector Momentum:  http://t.co/MryXrz5m #Citigroup #BRK,0,1.0,0.0,0.0
"Citigroup Capital VII Capital Securities Yield Pushes Past 7%: In trading on Tuesday, shares of ... http://t.co/6IgLufif #Citigroup #BRK",0,1.0,0.0,0.0
Citigroup Capital VII Capital Securities Yield Pushes Past 7%:  http://t.co/d5LnxD7z #Citigroup #BRK,0,1.0,0.0,0.0
Citigroup Announces Agreement to Resolve Certain Private-Label Securitization Repurchase Claims http://t.co/zH2e2gGbFX,0,1.0,0.0,0.0
Citigroup Announces $2 Billion Redemption of Trust Preferred Securities http://t.co/KRoICb6MZV,0,1.0,0.0,0.0
Citi Launches Advertising Campaign for Sponsorship of U.S. Olympic and Paralympic Teams Ahead of the Sochi Olympic... http://t.co/Q9opBKurzj,0,1.0,0.0,0.0
Sanergy is Named Global Winner at 2013 FT/Citi Ingenuity Awards http://t.co/7v9BD2ihKr,0,1.0,0.0,0.0
Citi Responds to Appeal for Communities Devastated by Typhoon Yolanda http://t.co/bLSJyvGkOH,0,1.0,0.0,0.0
Citi Leads Global Diversified Financials Sector in 2013/2014 Dow Jones Sustainability Index http://t.co/bSt4oroNT3,0,1.0,0.0,0.0
Citigroup Announces $369 Million Redemption of Citigroup Capital X Trust Preferred Securities http://t.co/SRWfc6uwfQ,0,1.0,0.0,0.0
Financial Times and Citi Announce Judging Panel for the 2013 FT/Citi Ingenuity Awards http://t.co/cb8DmKn6Mc,0,1.0,0.0,0.0
"66,000 Citi Volunteers Mark CompanyÌ¢??s Annual Global Community Day with Service Activities in 95 Countries http://t.co/yCdOUzjaBP",0,1.0,0.0,0.0
Citigroup Announces $954 Million Redemption of Citigroup Capital XVI Trust Preferred Securities http://t.co/7QzWOxmvF3,0,1.0,0.0,0.0
New Citi-Commissioned EIU Report Projects Competitiveness of 120 of the WorldÌ¢??s Major Cities in 2025 http://t.co/6735K8wUmB,0,1.0,0.0,0.0
Citigroup Announces $3 Billion Redemption of Trust Preferred Securities http://t.co/TCoTLugU0y,0,1.0,0.0,0.0
Global Association of Risk Professionals Presents 2012 Risk Manager of the Year Award to CitiÌ¢??s Brian Leach at 1... http://t.co/FE8tBWl3Bq,0,1.0,0.0,0.0
"Citi Announces Support for Vital Voices, Women's World Banking as Part of Effort to Boost Economic Empowerment and... http://t.co/Sl3fWbpkZR",0,1.0,0.0,0.0
Citi Announces Aetna to Be the Charter Healthcare Benefits Company for Comprehensive Digital Health Payment Platform http://t.co/Uhx8I386Gs,0,1.0,0.0,0.0
New Cities Foundation Expands Membership Network into Financial Sector http://t.co/h2YCJ67I10,0,1.0,0.0,0.0
Financial Times and Citi Announce Global Call for Submissions for 2013 FT/Citi Ingenuity Awards http://t.co/tMJYGZaj,0,1.0,0.0,0.0
Citigroup Successfully Completes Sale of 2.71% Interest in Shanghai Pudong Development Bank http://t.co/OQCn5rMG,0,1.0,0.0,0.0
Citi and The Financial Times Launch Global Ingenuity Awards to Recognize Emerging Leaders Transforming Cities for ... http://t.co/ldO4Rcwi,0,1.0,0.0,0.0
Citi Wins Global Banking Innovation Award from BAI Ì¢?? Finacle http://t.co/5Yndp5mf,0,1.0,0.0,0.0
Citi Team USA Flag Tour Stops in Tucson to Celebrate Sponsorship of 2012 U.S. Olympic & Paralympic Teams http://t.co/cINSbZoR,0,1.0,0.0,0.0
Citi Team USA Flag Tour Stops in Irving to Celebrate Sponsorship of 2012 U.S. Olympic & Paralympic Teams http://t.co/p1IdeN9i,0,1.0,0.0,0.0
Citi Kicks Off 'Citi Team USA Flag Tour' in Sioux Falls to Celebrate Sponsorship of 2012 U.S. Olympic & Paralympic ... http://t.co/X6rhmnvB,0,1.0,0.0,0.0
Citi Celebrates Sponsorship of 2012 U.S. Olympic & Paralympic Teams With Flag-Raising Event to Mark  Year-Out  Mile... http://citi.us/q8gtGU,0,1.0,0.0,0.0
Citi Engages with Suppliers to Drive Sustainability Gains http://citi.us/kVazam,0,1.0,0.0,0.0
Statement by Citi Chairman Richard D. Parsons on Retention Award to CEO Vikram S. Pandit http://citi.us/iSuFMA,0,1.0,0.0,0.0
"Vikram Pandit, CEO of Citigroup, Honored with UJA-Federation of New York's Banking and Finance Award http://citi.us/ivdJOK",0,1.0,0.0,0.0
Citigroup Announces Appointment of Candida Wolff as Executive Vice President for Global Government Affairs http://citi.us/gp104x,0,1.0,0.0,0.0
Citi Named Official Sponsor of 2012 U.S. Olympic & Paralympic Teams http://citi.us/fTmOi9,0,1.0,0.0,0.0
