text,crowd_label,conf0,conf1
book excel introduct perform consult assum alreadi tool know-how address perform need focu consult process found especi use question list almost everi chapter hale includ list question might ask client order guid pinpoint exact issu identifi best solut side consult often given littl attent book classroom vital importance.anoth worthwhil highlight coverag actual run consult busi term financi consider record-keep etc anoth great book goe depth run busi aspect busi consult elain biech,1,0.0,1.0
even accomplish execut take moment brows page organiz classic short book everyth time-manag system suggest score simple-to-impl strategi quickli improv effici effect revis edit updat incorpor electron advanc even tool mention alreadi render obsolet ... recommend book anyon ever complain much work littl time,1,0.0,1.0
need book cure insomnia ... pick august cure mine straightaway no plot ridicul charact no humour no suspens no insights..noth feel author recorded/eavesdrop psycho babbl psych clinic transcrib dawn 'patient got aggravatingli uninterest charact ... reader cant care dream lithograph childhood aunt boyfriend ... fact even start resent appear page ... skip whole chapter devot damnabl bore dawn.th redem featur book superb characteris dr. lulu shinefield ... especi shown vulner love ... insecur age woman ... that bore paper version sleep pil,1,0.0,1.0
im australian final year undergrad cs student use text cours 'network program book well written explain not process write network applic use c also actual protocol tcp udp etc work give solid understand 'whi network program not 'how overal great book want learn network program unix system want refresh highli recommend,1,0.0,1.0
not help notic review say franc girl boy enjoy smart spunki littl badger quirk problem well creativ solut wise parent univers delight children,1,0.16388796667585948,0.8361120333241406
think perfect book teach son stranger tri introduc idea could not explain stranger without scare alreadi like berenstein bear put tough subject level great job explain differ stranger would recommend book everyon young child purchas copi nephew well,1,0.0,1.0
fagan add new dimens failur civil outsid valu revers psycholog self-destruct pose brook adam spengler de tocquevil data varieti sourc not avail correl histori impact climat civil fagan open curiou person experi small sailboat treacher spanish water pass cargo-laden hulk seemingli oblivi natur 's furri introduct becom wonder analog scale vulner complic societi tame natur also massiv increas calam natur 's accumul respons sumerian citi ur becom first tour tour fagan hit stride crystal point sumerian centerpiec conceiv around num4 bce collect villag alreadi employ canal irrig region suffer monsoon shift drive sumerian increas organ innov henc invent citi num4 bce volcan induc climat shift eventu ran sumerian ship aground similar shift other not starv popul dissolv faith god king way life fagan write intric equat urban popul readili access food suppli econom polit social flexibl suffici roll climat punch irrevoc alter ur small trade ship industri civil supertank supertank split half abil simpli return farm hunter gather lost given mani us occupi landscap compet everyon els condit us comfort notion shin hunt rifl return natur tent calam forget societi stretch limit falter climat chang stress psych come fore way never imagin even especi abras group-ori societi like tribal suspicion lie wait opportun make light postmodernist without tri fagan note human respons cultur separ thousand year differ contin mean valu system old world new human societi react climat trauma social polit chang startl similar univers human truth becom supertank among human societi oddli inattent one tini fraction peopl board engag tend engin rest buy sell good among entertain ... bridg no chart weather forecast not even agre need inde power among us subscrib theori say storm not exist ... no one dare whisper helmsman 's ear might consid turn wheel end well written time spellbind account past warn present ignor peril,1,5.3362024096367255e-39,1.0
book cornucopia photograph text paul mccartney veteran entertain busi class act boot clearli happi quit comfort stage job no doubt fan well moder interest paul mccartney well beatl delight book love paul mccartney not extraordinari showman seriou dedic music muse music purist truest sens term respect art abl creat perform music paint music mural word full rang abil perform mani differ music style make music versatil like feel cooper appear underscor peopl directli involv show ... sound like entir crew wonder time enjoy fruit success technic enabl paul mccartney spectacular show paul mccartney acknowledg speak highli also accept outpour love audienc grace aplomb never lose humor approach.to book 's credit paul not put stage pedast fawn spoonf obsequi flatteri peopl directli involv product execut concert seriou job well reflect actual perform job not curri favor anybodi natur enthusiast perform no doubt make contribut toward show could prompt enthusiast delight photograph delight reader see paul fun off stage love wife heather crew made possibl book speak profession part crew perform photograph write concert book truli beauti mani funni touch endear seriou part gestalt whole greater sum part whole perform crew love one audienc part product made whole show/experience/book wonder glimps behind perform 's curtain,1,0.0,1.0
thoroughly-research carefully-plan expos heinou crime one victim 's journey woman-in-deni crusad fascin speedi read engag reader outset mehnert dalessandro magag weav togeth fact give us multipl perspect even empath protagonist jane alexand especi reveal move revel person journi jane other like crimin justic system not alway dilig pursuit offend,1,0.0,1.0
want guidebook fill smirk insid speak trendi establish faddish bar altern shop locales-du-jour random list so-cal cool place smug reassur pedestrian tourist ooh aah gastown take pictur totem pole outsid stanley park guidebook want someth bit organ use get real travel guid vancouv map one poor lowdown list traips wildli citi without sens vancouv 's highlight fundament citi navig tip not appear p. num3 num3-pag book irrever mayb better dub irrelev guid frommer 's found clever way increas market share assur reader feel like led around citi savvi local instead felt like not led reason travel advic left travel profession self-import cliquish book -- help guidebook not,1,0.0,1.0
book review verilog code techniqu part one introduc genearl code behavior code rtl code techniqu make reader understand import code techniqu book also explain synthesi issu simul issu chapter introduct basic build block state machin complex function error dection correct memori control verilog behaviour code rtl code introduc chapter book basic familiar verilog languag use valuabl hardwar design hardwar system engin student,1,0.0,1.0
gift artist world judi chicago men continu pretend women artist not even exist chicago fought male paradigm won gut-wrenchingli honest write inspir lot fear among male tri keep women show work everi feel women noth worri far goe artist like judi chicago continu astonish brillianc,0,1.0,1.0246885763888635e-230
darwin 's tightli held theori natur select let loos resist public public also proud intellectu darwin 's network scientif friend associ provid strength highli disrupt theori advanc scientif career,0,1.0,0.0
librarian garden club small budget buy book meet need happi by-product activ learn best one buy one great index cultur inform plant descript almost everyth not everyth almost make indispens us refer annual plant sale meet would say popular book meet one own individu member,1,0.0,1.0
jim gibb simpli guru northwest maritim histori book rang west coast fascin tale ship mishap contain plenti photograph shipwreck interest anyth shipwreck jim,1,0.0,1.0
dear reader cincinnati ... say ist n't fog cat 's feet carl sandburg anyway find matthew great poet musician enjoy sensit art especi jazz,1,3.2131203253698764e-20,1.0
everi american know stori rosa park peopl help dismantl jim crow rais digniti american fascin enlighten book would serv well part everi american 's librari despit modest size pack plenti detail like not part familar rosa park lore instanc bu driver jame blake previous run num2 year earlier sinc becom person avoid also attend non violenc resist workshop school tennese arrest father left child husband barber later drink problem detail give us insight human rosa park today import thing got book courag intellig hard work mani peopl requir chang societi better,1,0.0,1.0
everi thing want vampir book even call hero not nic,1,0.0,1.0
someon plan wed got huge kick out book made laugh out loud discript could imagin charact aspect could see charact give book two thumb anyon look good book entertain,1,0.0,1.0
definit excit interest sci-fi book read year terrif work first-tim author love sci-fi sex not abl put vehicl mind transfer carleton heavisid allow explor sexual fantasi explicit detail old man young man 's bodi man woman 's bodi woman man 's bodi young woman old woman 's bodi graphic describ book not faint-heart unsophist adult true joy begin end not wait sequel,1,0.0,1.0
thoroughli enjoy book look program use set goal alreadi read goal brian traci nice not give best start point read say talk also great book decid read one gave exactli look first part book self-talk familiar read helmstett book second part goal easili abl appli current use program goal set third part discuss person coach highli recommend,1,0.0,1.0
kern 's easy-to-read educ analysi allow us reliv stori see build confid self-understand harri 's choic base valu rather outsid pressur num2-som year old left brain typic interest non-fict start read harri potter book admir made kid interest read believ read key child 's futur want understand motiv book give young peopl far love num potter book 6th one order also gave potter fever num2-year-old dad brother tough num2-year-old prison read pass around inmat said see mom love read found read wisdom harri potter edmund kern drawn great art cover subtitl tabl content not mention kern 's credenti introduct wisdom harri potter made feel great choos delv rowl 's stori mr. kern deserv num2 star share brillianc delight,1,0.0,1.0
therapist use guid imageri alot rossman 's book invalu therapist client well clear recommend client interest heal power interact guid imageri surpass quid imageri come anoth word better help guid someon heal place imag symbol never ceas amaz self heal mechan possess even trumat suburb book rest,1,0.0,1.0
negril special place reimer 's book take bring back lot sweet memori want great novel set magic place take look jamaica girl jon michael miller 's novel show real jamaica far behind wall famou all-inclus resort see struggl joy wonder peopl well meet rosalind juliet mitchel fabul brave resourc protagonist search love freedom far best book jamaica ever read wonder stori suspens sexi funni disturb quit move wonder charact great messag power love transform one 's exist great read vacat even vacat,1,0.0,1.0
book quit easili best text seen break cardiolog easi comprehend absorb topic cardiovascular technician use book numer occas either better understand patient 's patholog condit help prepar lectur class feel excel job compil necessari knowledg make readibl cardiolog standard branwauld 's hurst 's may cover topic better lilli co. great job summar subject personn favorit book chapter murmur heart sound congenit heart defect cardiovascular pharmacolog best review potenti mind-boggl topic seen whole-heartedli no pun intend recommend book involv field cardiolog make great desk refer price not burn account,1,0.0,1.0
entertain inform biographi develop continu rework modifi theori evolut put charl darwin tidbit inform regard darwin 's person life habit behavior author david quammen also touch work alfr russel wallac parallel develop theori evolut aquaint darwin mani promin men scienc also mention elabor quammen capabl talent stori teller bring wri sens humor keen insight subject could easili spiral morass boredom less capabl hand charl darwin brought life not assidu workahol prober natur world human gentl compassion husband father complaint wonder littl nugget short would prefer volum twice long no longer quammen also comment book 's breviti recommend work not thorough quammen 's song dodo good read knock off afternoon plu may learn thing may not known one great scientif theorist nineteenth centuri one final note funni bit regard human genom vi vi mous made laugh out loud sever minut knew scienc could funni pithi remark alon worth price modest littl book,1,0.0,1.0
grandpar eight grandchildren read cathi cohen 's book great interest recommend parent grandchildren simpl build block approach acquir social skill self confid children struggl accept not know meet failur extrem benefici parent may challeng tri help youngster meet success wish avail need,1,0.0,1.0
flatten exampl hypertext three level inventor word ... provoc evoc ... violat rule unusu person yet candid ... examin subject philosoph well pragmat ... *the* semin work hypertex,1,7.933617734611197e-24,1.0
num4-discharg armi no longer callow youth lack motiv gave univers life whirl bought book whim still bedsid delight collect earli help provid spark need continu educ discov knew littl world heck wolsey spire oxford boar war encyclopedia,1,0.0,1.0
origin purchas autograph copi book eric carl museum pictur book art vacat massachusett last summer decid purchas copi mom friend love great illustr well thought messag book read children love book everi way explain difficult concept optimist versu pessimist loyalti pride modesti relat way young children jane dyer 's illustr perfect complement ami rosenth 's word uniqu children 's book remain librari long children grown,1,0.0,1.0
thought book infom educational.it give great insight dr.shulgin wife life work.a must read aspir chemist.thi book cut away propaganda surround mani recreat compound chemic fact noth else.educ knowledg alway friend,1,0.0,1.0
hard book put enjoy everi bit besid good view histor event europ num2th num2th centuri book offer insight reform counter-reform along natur theolog disput servetu calvin particularli enjoy part trace proven three surviv copi christianisimi restitutio iron calvin 's copi one three survivor -- -and order copi burn,1,0.0,1.0
good book give much inform holi pentecost tradit good talk also charismat movmen variou church interest document differ approach sanctif baptism holi spirit two work experienc depend one anoth creat divis among earli pentecost howev think today 's pentecost believ emphas need holi sanctif word blood christ holi ghost let us yet testifi jesu christ savior baptiz holi spirit healer come king make holi church endu power high,1,0.0,1.0
titl speak collect wood display book shown qualiti class inform avail wood amaz qualiti book best seen thick paper except color photograph type clearli legibl pictur inform name use work properti geograph distribut much buy book not regret time save hunt inform recov price paid,1,0.0,1.0
john lesli may familiar reader either work jnuml macki 's _the miracl theism_ latter macki present lesli 's 'axiarch essenti view cosmo exist good plausibl altern tradit theism though altern macki reject disbeliev object 'valu anyway .in fact not realli 'altern theism correctli one possibl philosoph understand _of_ tradit theism point lesli acknowledg herenumin lucidli written well-argu volum lesli present less neoplatonic/spinozist outlook access term updat version expound _valu existence_ repli variou object plausibilitynumhi theori summar two major these everyth mean 'the univers simpli _is_ thought divin mind everi object univers either object divin thought case consciou be like portion subsystem divin mind 'or not exclus may well object subsystem b divin mind perhap infinit number mind exist _good_ -- inume. mind relev sens 'know everyth worth know exist one case fundament sort 'ethic required power bring 'requir state affair beingnumfor reason two these not seem intuit plausibl everyon lesli rais meet object object effort show plausibl realli object base recherch topic set theori quantum physic field reader without much philosoph sophist prepar work bit lesli 's explan clear self-contain cours not remov controversi not claim put even strength belief b better num2 far short certainti meet quit lot nontrivi object cours right question philosoph interest answer 'provabl strong sens anyway strictli speak one could accept one these not lesli also show relat -- inume. creative-power-of-valu argument make better sens pantheist cosmolog vice versa crucial claim -- one lesli support length -- claim mind 'mental stuff could certain requisit sort uniti not tri summar argument recommend reader profit clear nuanc philosoph exposit think these sound -- although alreadi panentheist/panpsychist read book lesli given lot addit food thought way lesli refer theori not 'panenth 'pantheism hope never meet bore argument like might also check out timothi sprigg 's _the vindic absolut idealism_ one sold,1,0.0,1.0
hell 's angel all-tim endur classic late gonzo journalist hunter s. thompson interact detail descript one 's affili dread motorcycl outlaw known hell 's angel write style quit fascin not base actual account interpret thereof would fascin seri pulp fiction storiesnumth group hell 's angel describ group unhygien individu no particular goal life know road travel lead no success highlight know financi social oblivion situat go get wors character except rare uneduc bum no purpos long run choos live moment go bar drink heavili engag unspeak sexual act tortur get way psycholog physic sexuallynuman intermitt account hell 's angel especi lower-rank member portray laden paradox comparison drawn physic attribut bike ride one hand angel sloppiest individu worst kind yet bike love well-maintenanc machin thoroughli polish chrome steel one recollect thompson mention off bike appear clueless spastic inan inarticul dolt got bike becam transform someth quit opposit entitl king road clumsi foot would compens master use motorcycl includ indescrib abil skill grace go around highli danger curv num3 mph point reader come realiz he/sh california highway mid-num4 's especi near oakland berdoo no one mess angelsnumth paragraph shed light angel notori way right inde angel could quit perplex group despit nihilist tendenc sever member angel consist chapter throughout california variou part unum multi-facet group form maintain presid highli systemat highli organ individu hunter thompson mention grand poo-bah chapter name sonni barger primarili ran oakland chapter astut intellig individu much attun activ polici enact california law know order reduc not erad deal polic patrolmen time place angel activ well no angel around .even includ unusu account owner whose store along highway angel would frequent would intimid angel relinquish busi biker hour return find noth stolen shop even better shape angel arriv not thompson record account angel could good storekeep moment also made note excurs would actual leav behind money counter purchas beernumpsycholog complex dysfunct yet function could angel ever thompson 's adventur thompson acknowledg angel regard hippi not fashion attribut anti-vietnam war demonstr fact thompson mention by-and-larg angel not like latter bunch interestingli enough thompson point out group physic similar ideolog dissimilar present mid-num4 's tie would bind group sum thompson would cite peac demonstr turn against valu instil previou gener rebel against past angel without educ market skill thrive develop technologically-driven unum market rebel against futur .all thompson share interest experi not get juici detail one might well receiv messag deal peopl like num4 's hell 's angel want surviv might well put philosoph theme ethic hold unless equip ration need self-preserv conclud portion paragraph regard natur hell 's angel despit everyth psychiatrist freudian castrat say angel tough mean potenti danger pack wild boar moment fight begin leather fetish inadequaci feel entir besid point anyon ever tangl sadli testifi ... chanc emerg unmaim depend number heavi hand alli muster time take smash beer bottl leagu sportsmanship old liber young fool,1,0.0,1.0
sinc num4 world particip singl global histori yet american historian tend treat countri though histori isol world new interpret american histori set within context intern influenc colon pattern object decision-mak process reach around world direct nation among nation america 's place world histori remark seri connect american event world influenc drawn histori professor dozen book namenumdian c. donovancalifornia bookwatch,1,0.0,1.0
chang no news great chang alter commerci polit demograph work world alreadi underway consequ quit predict say author peter schwartz outlin varieti import chang particularli place china india limn scenario repres possibl futur perhap sort book inevit turn centuri millennium author fact compar work predecessor end nineteenth centuri although predict fall far short shock exampl global warm age popul hardli undiscov issu exercis think scenario prepar strategi good one book also entertain schwartz write light hand casual style believ book would good airplan read would certainli appropri long flight sinc air travel contribut import chang author discuss read time fli,1,0.0,1.0
came upon pgw no systemat way favorit may easili access jeev wooster drone club golf stori mr. mullin tale take occasion chanc read wide wodehous howev came across french leav delight everi sens repay even better known wodehous fare becom tangl involv cultur sensibl paint special pictur young love french leav could easili dori day movi paint visual travelogu actress high spirit light comedi free reign uner touch master,1,0.0,1.0
enjoy book begin end start read could not put one best thing ever happen not conflict scientif belief spiritu religi one though alreadi knew thing true brought surfac could re-affirm would recommend book anyon ever ponder origin univers question faith higher power hope someday becom proof instead strong theori believ could miss link unifi field theori ... new hope futur spiritu worldview may overcom war terror strip away mask creat organ religion.wakecowboy,1,0.0,1.0
book mere list toy gener commerci avail might stimul help child commun biggest complaint print wonder young children num num2 month notat discov yesterday ... copi jump page num2 page num2 page not fall out bind not includ book bound check buy not sure problem uniqu not,1,0.0,1.0
wish could give book six star instead five num2-month-old daughter want find new creativ way interact also teach import skill discov book brows amazon one day thrill variou numer idea offer best not buy special materi activ requir simpl object probabl alreadi home instanc miller provid recip homemad fingerpaint share instruct make shape-match game tell creat pictur file expand child 's understand categori book must-read parent want stimul toddler 's mind,1,0.0,1.0
cook summer drag make whole hous hot recent found great new book fell love book salad dress produc joy cook folk know provid excel recip alway hard time creat salad dress origin salad guess book eas book well organ easi read love extra tip extra materi add book hope enjoy book much,1,0.0,1.0
time someon author good histori armi tennesse share histori armi potomac armi northern virginia yet possibl success armi neglect well-written thoroughli research piec must read civil war buff,1,0.0,1.0
anyon interest china histori polit read book num-num year ago buy copi friend travel china amaz stori read like fiction factual,1,0.0,1.0
lot neg review not know book suppos not go give new inform someth read start finish one disappoint person state glossari suppos one r expect anyth els cours not go like it.if tri find certain page scene miss someth confus book help out help out lot also refer revis gunsling two book differ look forward next volum,1,0.0,1.0
awsom book everi thing need know hors,1,0.0,1.0
leuci colleg professor read book rememb class lectur realiti write sometim scari book not cop stori releas truth behind polic corrupt book perfect compliment princ citi final book written first hand person went highli recommend,1,0.0,1.0
book written form diari -- not done correctli extrem bore simpli not case book rivet throughout read book num day could not put book follow life mari teen year death written might felt well-develop charact fast plot made read well nightnumi not normal read type literatur bookstor cover caught eye start read immedi hook book held interest complet attent first page last fact found re-read part thought written extrem well not think mani peopl written review given book enough credit due erickson not write histori book taken liter though much book realli histor valu felt imag paint mari antoinett well done peopl critic book soften imag mari actual enjoy altern perspect erickson often adament non-fict mari one extra-marit lover book portray book fact written diari therefor imaginari eye mari antoinett simpli might viewed/felt aspect lifetim book well written contain romant sentiment -- not find over-bear tacki fact ad extrem dramat plot one best book read long time glad took chanc read recommend book whole-heartedli,1,0.0,1.0
outstand look modern intern crime robinson detail fact put togeth compel fashion make book much page-turn crime novel knack take complex subject make clear without dumb highli recommend book especi want know war drug fail miser,1,0.0,1.0
tast indic anyth billi collin dull person poem uninterest except not even write sentenc volum tediou not buy,1,2.653617403668221e-57,1.0
