text,crowd_label,conf0,conf1
thought hot splash danc blue iguanna got see film movi free spirit come term complex emot abl overcom prior societ condit concern right wrong soon learn go much happier fulli liber earli num2 's film real num2 's vibe cool also suggest great daryl hannah film call wildflow,0,1.0,0.0
film extrem heart-warm throughout ... end ... becom exactli opposit heart-break stori completli absorb fascin viewer captiv caught live mancho young boy begin school first time older brother play saxophon later find chines girl fall love father tailor teacher don gregorio kind elderli teacher help mancho adjust mani way provid person individu attent help open mind learn natur literatur mancho asthma mother worri affect son school one scene don gregorio help mancho avert respiratori crisi ... gratitud help given son mancho 's father make new suit teacher free charg innoc act eventu turn someth cruel unexpect polit climat civil war caus citizen denounc ... numer endear scene mancho don gregorio teacher mentor young pupil mancho also learn mani thing life world manner boy often learn friend exampl friend visit local tavern male patron describes/brag local bartend physic love relationship local femal two boy follow patron home spi liason ... one funniest scene ladi dog tarzan tri bite boyfriend 's nake butt engag make love boyfriend enrag dog constant bark later exact reveng cruel manner ... film show fear threat persecut caus ordinairili good peopl becom cruel show mob mental take one 's life stake sad fact surviv instinct kick someth possess peopl rise crowd moral right thing ... erika borso pepper flower,0,1.0,0.0
captain kirk transport shakespearean act group led anton karidian benecia coloni planet qnumprior arriv dr thoma leighton contact kirk wish inform new synthet drug creat instead tell karidian realli kodo execution tyrant tarsu iv respons num num3 death includ member kirk 's leighton famili execut num num3 peopl kodo justifi food shortag kodo appli person theori eugen decid live die dr leighton found murder kodo lead suspect riley found poison near engin mccoy abl revers out poison blood spock use comput determin karidian kodo person use opportun proxim kodo nine eye wit proof howev voic match fail becaus kodo injuri close match not decis kirk 's charat undecis spock confront kirk said brain much caution kodo kill member kirk famili one would think kirk would wrath seek reveng instead spock not kirk outspoken charact determin prove karidian kodo strang consid kirk never one proof often act intut kirk want proof answer kirk secret plot get truth anoth captain fake engin problem enterpris pick act crew bring kodo closer spock must thought kirk out vulcan mind probabl want kirk whole crew arrest howev kirk want evid imprison crimin press charg kirk bring devil backyard attempt get answersnumth daughter lenor one behind assassin nine wit lenor accident shoot karidian confront kirk goe mad lenor act innoc seduc kirk facad murder lenor obsess father tutelag kodo archtyr type tyrant kodo hilter ruthless follow dement logic involv mass execut num num3 peopl power kodo cruel fear out power fade civil undetect live doubl life kodo seem live blameless life no suffer crime no pentit evil everyon think kodo dead burnt beyond recognit archtyr master plan exit myster surviv hyper-paronia forc lenor lauch assassin attempt remov possibl detect nine eye wit includ nine kirk despit fact murder place num2 year ago without undetect time kirk escap phaser set overload quartersnumif hitler aliv today would easili undetect probabl not super ego would push hilter back out lime-light kodo differ secret plot destroy peopl leighton privat disclos kirk terribl secret,0,0.9999999999999996,4.234707833244167e-16
rememb first watch movi parent shortli came out video not fan basebal basic thought would hate wow ever wrong absolut love movi music beauti jame horner outdid movie.wel saw two disc anniversari edit come out order right away bonu featur great stori movi came biographi w.p kinsella author book commentari much more.but featur dvd not bought bought movi incred make believ imposs realli happen messag ray kevin costner get give chill ... way deliv great 'if build come 'eas pain 'go distanc well movi certainli went distance.th music realli make movi great music hear toward end movi give chill make cri ... good way not like basebal like movi movi special messag highli recommend anyon love,0,1.0,0.0
great film- wish great score go neil brand fine talent compos opinion score wrong modern period brassi loud sound fake unfortun heard brand improvis piano score film sever year ago great still give five star qualiti pictur,0,1.0,0.0
not believ review review dvd great movi not get wrong kurasawa one star peopl mei ah put out dvd whoever subtitl translat not speak english well enough graduat level one esl class subtitl truli terribl sometim bizarr thought time dream watch monti python skit ala not real shame,0,1.0,0.0
favorit stephen king book turn movie.i still cover eye one,1,0.0,1.0
watch num season great ... buy e,0,1.0,0.0
ever readi love come come know love question movi answer use music lyric touch heart movi explor three relationship differ level worth watch,0,1.0,0.0
begin long film audienc see spectatcular view red dirt red mountain burma signific one familiar buddhist tradit dust symbol mortal world suffer repres one want brush off one desir follow path buddha see bleak terrain audienc introduc small contig soldier led captain inou former music teacher order keep troop spirit captain teach men sing vari degre success gift soldier mizushima taught play burmes harp master quit skill trudg along harsh landscap soldier find shelter food small villag villag feed shelter soldier want perform song villag turn back troop later learn japan ceas fight captain inou men peac turn british howev pocket japanes soldier still fight captain inou ask mizushima inform one group soldier stop fight give talk british colonel give mizushima thirti minut make peac japanes mizushima speak command japanes forc instead give fight bitter end complet wipe out british mizushima surviv serious injur discov buddhist monk nurs back health one day take bath mizushima 's cloth stolen done robe buddhist monk also shave hair travel around given food devout buddhist peopl point mizushima 's main goal reach mudon reunit unit see hill made bodi deceas japanes soldier funer ceremoni perform british fallen japanes soldier take new path buri bone fellow soldier howev old friend not forgotten ... movi base takeyama michio 's num4 novel name come seriou critic portray japanes soldier basic happi bunch victim britsh fact japanes brutal burma china manchuria sever countri howev film creat ten year novel direct ichikawa kon humanist director watch film take grain salt not let salt get eye keep enjoy film,0,1.0,0.0
great movi erot scari time talk ultim voyeurist tendenc film end total surpris though,0,1.0,0.0
watch movi laugh hard everi time watch much fun,0,1.0,0.0
piti poor mall punks.seem like dink hot topic frequent buyer card labret pierc punk day ... well kid quit honest ya ... easy.do favor ... hell us favor ... take look cd collect band therein sort rotat music video channel choic ... .throw out.then go buy dvd see punk alway about.y see kid back day old timer like refer punk not exactli hip thing ... got ass kick everyone.jock cop redneck ... punk danger prospect ... .show often broken polic ... violent vital real.thi dvd gimps era.an era chang way world look whole lot us.i suburban kid ... band like clash sex pistol damn open eye whole differ segment societi never knew existed.so take time learn littl histori band matter ... better it.for us older type ... dvd amaz document.th live footag great ... interview entertain ... frankli see joe strummer talk histori band brought littl tear eye.th bonu footag killer too.anyon call fan probabl alreadi own disc ... want discov band import mani must see,0,1.0,0.0
drummer high school play jazz earli num2 highli recommend dvd beatl came out band start pop around home town realiz could make money play rock learn motown song thought singer good alway want know play music behind fantast never mention know know made girl lick joan osborn sing heat wave worth price dvd must view anybodi play band num2 num2 funk brother final get recognit could rate dvd higher num star would bonu featur better movi,0,1.0,0.0
serv armi intellig offic berlin west germani cold war whenev feel nostalg want time-travel back cold war num4 's turn funer berlin film wonder shot berlin wall west berlin time michael cain 's harri palmer mirror imag thousand intellig personnel battl incompet bureacraci still tri accomplish mission hand watch one,0,1.0,0.0
seen sever time year still not make sens favorit act subpar drama cheesi opinion activ duti sailor fail quit miser captur true spirit navi think lunat tom cruis practic built career off garbag ... sigh..,0,1.0,0.0
grew watch doctor pb back tom baker era overjoy hear bbc restart seri suffic say season num everyth could hope,0,1.0,0.0
first ye film made vancouv shot manhattan skylin golden harvest make film tri best shoot angl not show mountain paint grafitti day unpaint night jacki chan told simpli forget focu action.wel action focus inde sure funni see chines thought unit state time see film hippi drive around truck full beach ball also get multi-ethn gang trash place serious gang nativ american pigtail fray jacket almost offens fat cop sit around smoke cigar random small-crowd rock concert everyon dress anim suit bizarr indeed.a action film best first fight scene groceri store supurb grace use jacket dispatch enemi endlessli hit guy nose take entir gang back alley get corner impress lead scene chase around street new york entir gang motor cycl tri run jacki must reli abil run like wind climb like monkey also danger stunt jump roof park garag onto fire escap anoth build no har wiresupport fight scene gang 's hideout also one best use whatev object get hand ont acrobat also jacki chan cling hovercraft drive water land done broken ankl dvd uncut undub origin score would give total three star unfortun so-so film new line make wors dub bad seem new line dub origin english dialoug also littl origin cantones dialoug also film 's origin score redon orchestr score slight rock mani mani scene cut origin movi not action scene cut tri find uncut version out dvd stay away,0,1.0,0.0
first thought new one almost gave bad reviewnumth new version not worth watchingnumbuy one 3d still find itnumit worth wear glass,0,1.0,0.0
first saw movi year ago serious start read shakespear life time sinc recent opportun see movi time dvd movi although imagin creation well root histor realiti shakespear commerci artist commerci theatr shakespear 's play popular entertain day citi london regularli threaten 'low brow theatr entertain industri closur shakespear often wrote part favourit actor theatr 's star aspect illustr rollick screen play leav us question sure shakespear must love write love passion irrever product actual uplift shakespear probabl greatest artist time not inhabit ether mount olympu work earth make work great,0,1.0,0.0
movi funni part not mel brook standard young frankenstein not not movi children num2 simpli one movi great talent wast,0,1.0,0.0
hyster funni perspect transit high school adulthood john cusack deliv terrif perform minni driver joan cusack,0,1.0,0.0
realli irrit show least earli year good show ever fact studio cheap pay right music ridicul add insult injuri pictur sound bargain basement qualiti think everyon bought show alter return show full refund let cheapskat studio eat loss instead make fan digest sh**,0,1.0,0.0
name burton jack burton fun action adventur not seen movi highli recommend jack burton belong jack sparrow indiana jone han solo movi came out hope futher adventur jack burton mayb someday someon write keep list favorit jack burton reflex,0,1.0,0.0
instead settl four episod includ retread alreadi releas go recently-releas volum volum write two market third releas next month contain num2 episod everi episod believ order not miss out get everi stori rememb kid younger adult ... geek know money folk not disappoint,0,1.0,0.0
enjoy abbott costello show much never tire comedi qualiti dvd b w pictur sound also excellent.pnf californi,0,1.0,0.0
van fan real deal incred perform van except band horn section pee wee elli mark isham worth price alonenumthi might best num2 ever spent would spent num3 us probabl never get chanc see van live set like thank video poster comment num4 perform,0,1.0,0.0
... ... ... ok watch hbo movi came im like crap smell ya later decid wait tad bit longer best choic ever made sooo goood act great charl nail like would grunt growl remind girl know see stepe shoe said wwwweeeeeeeeeee mean like pig squel respons wwwweeeeeeeeeeeeeeeeeeeeeee kept tirerd out fell asleep stand use larg role fat support fat head ok littl off subject still get off chest yea movi great uhh yea go buy give movi num uggg grunt out num,0,1.0,0.0
one best anmait batman movi mask phantasm bring histori charact like no movi begin bruce wayn foil robber not afriad tri come way goe alot way dose n't come bat first off along way meet love andr beoument fall love tri get vow made parent 's stop crime leav find cave hous come batman persona fast foward present see ms. beoumont com back town phantasm kill mob member batman take blam joker blow citi out dought buy bought first came out vh came graphic novel adapt find intrest see compar actor tv seri mark hamil give best perform life joker person best jack nickleson role,0,1.0,0.0
not awar babi einsteinnumy live rock babi actual watch num week person work children development challeng highli recommend video opinion babi watch day help stimul brain develop,0,1.0,0.0
movi show lack choic japanes women face post war era sens frustrat uncertainti beauti protray mama worker bar essenti two choic growign older bar get marri peopl offern marri older man offer money start bar get closer like movi effect protray sens frustrat mama must drink liquor not want buy expens cloth purfum not want order stay busi movi show no option besid marriag bar hostess mama definatli not feel good movi feel put light shame aspect sociti not provid women enough option freedom,0,1.0,0.0
rec 'd item coupl day pleas service.. keep good work,0,1.0,0.0
great stuff film music much like jame bond even better jame bond film combin highlight ladder fight scene cours skateboard chase chase like jame bond 's end better jump off cliff grab helicopt helicopt get explod jacki let go land ice frozen pond stay water num2/num2 second jacki almost die hypothermia stunt,0,1.0,0.0
last purchas series/box set thrill everi one item proud bookshelf,0,0.999981138280808,1.8861719192002587e-05
first thing first moiv suck ass suck even ass dumb anim ever dumb stori dumb secen donot repeat donot make bit damn senc aviod cost,0,1.0,0.0
funni show lot insight elderli care issu,0,1.0,0.0
anticip great hardli contain count day no minut till arriv doorstep fear may well keel heart attack die not abl stand hope poor heart hold out long enough actual watch movi happi,0,1.0,0.0
know look get cabl mostli like interest use gamecub awar cabl fulli function nnum2 well supern wii nintendo never chang a/v connector back system except ne use mono standard rca style a/v output use cabl not gamecub nnum2 nd supern look great well great old school system look would amaz old cabl antena connect signal hid almost blur look better lol say seriou old school gamer videophil go want consid cabl,0,1.0,0.0
not seem make fm recept better except fact tri get classic station nyc horror got loud clear local christian station not want recept complet gone went back antenna came onkyo tuner sort work not much luck pin dot tune system gain made static-i pain .bottom line attempt return cc see goe,0,1.0,0.0
not know cartridg dri not print properli unlik previou cartridg bought,0,1.0,0.0
got one month ago cancel cabl servic watch over-the-air importantli free local network hdtv program got enough channel denver program shown true hdtv format pictur breathtak cours mani program not true hdtv format yet not olevia 's fault program hdtv soon num4 station requir switch hdtv good thingnumpro pretti much everyth tvcon els remot,0,1.0,0.0
except screen protector internet forum aximsit com suggest one instal screen protector bathroom steam run shower order minim dust good idea live dusti place found can air inadequ thought clean enough screen surfac astonish amount dust trap fail rid process dust appli protector everi tini speck visibl afterward glare blemish,0,1.0,0.0
absolut love headphon realli picki come ear bud ear bud hurt ear hard hear comfort not turn volum way hear highli recommend littl earbud well worth invest,0,1.0,0.0
cabl work well anoth much expens brand purchas great product great price,0,1.0,0.0
first remot found oper audio video compon reason price easi set improv would recommend increas font size use identifi command,0,1.0,0.0
ok got gift got noth lose right well littl gadget first open door ipod world got ta say realli give awsom impress toward appl accomplish ipod shufflenumev sinc unpack littl thing everywher go exercis sleepingnumanywher pocket put ipod shuffl alway whenev need kick tune ultra light portabl realli achiev meant accomplish first place talk num gb store mp3 num2 hr playtim hard not fall love littl part menumlol sound qualiti decent quit easi charg transfer/upd tune go fast pace mobil not control freak ipod shuffl definit good way get giggi,0,1.0,0.0
great product need way tv play hot tub stereo speaker could hear tv porch hot tub sound great minim hum impress num2 spent,0,1.0,0.0
bought netgear wireless router make home wifi work fine even basement take laptop anywher hous desktop upstair bedroom basement work fine great product,0,1.0,4.230822640862082e-57
love new mobil media companion previous own handspr visor delux boy upgrad color screen bright easi see program system set etc easi find use keep medic inform doctor appointmentsnumi would recommend unit anyon consid pda make sure put larg memori card 1gb larger,0,1.0,8.752330128083143e-294
previou review similar mine one watch discoveri hd theater immedi realiz great tv also pictur qualiti sharp color beauti tv not num3 pound weight enjoy num2 samsung dlp hdtv way ever realiz possibl,0,1.0,0.0
abl use devic eas work well garmin forerunn num3 must want use num3 bike,0,1.0,0.0
love dvd player huge step old one not progress scan not difficult time get use control alway pain get new system on-screen featur fun like abil adjust posit subtitl watch movi lot nice freedom overal dvd player not absolut best dvd player out look high qualiti player low budget price definit perfect item,0,1.0,0.0
own everi type all-in-on mfc out brother best printer go paper jam small hick-up never printer not brother least expens best small offic never use hp canon brother best price toner,0,1.0,0.0
headset need clariti microphon great languag softwar use comfort enough use hour time,0,1.0,0.0
great littl gadget live next comput long time price right learn program wheel probabl wonder live without one said understand might not control everyon scroll scroll scroll day long use num-num command variou program buy invest time learn use not regret,0,1.0,0.0
read review phone agre would never buy anoth ge phone fact wait new uniden cordless phone arriv amazon meantim tri experi yesterday took batteri out phone spray key talk button front num3 orang power realli dous good blast phone steam hot water much screen fog shook excess water out duct tape phone fan button face fan today hook batteri back put everyth back togeth tri work fine even without charg not keep press number num time get regist work similar new done stereo receiv take cover off put bathtub squirt spray cleaner blast hot shower put two fan three day work fine sure not first person make sure not unit plug get shock result tri got lose,0,1.0,0.0
although prefer akg knum3 listen compet entri beyer close almost coin toss one recent comparison headphon artcl came dead heat surpris consid dtnum3 one reason price major mid-pric headphon bass full nice textur not touch bass bloat found high detai never seem sharp overal sound offer huge soundstag instead music top beyer lend perceiv distanc feet th make classic music sound doubli eleg surprisingli make rock music grandios appeal kind way headphon not requir headphon amp certainli profit one num2 ohm version make volum though num3 ohm version standard best daili listen dtnum3 sound great lack tad knum3 's high-end sparkl convers beyer 's valu comfort workmanship not help impress phone labor shadow akg senn num3 listen alway impress dtnum3 sound may best valu mid-pric all-purpos headphon,0,1.0,0.0
replac cartridg paper epson pictur mate great print amaz qualiti conveni cheaper get product amazon epson 's websit,0,1.0,0.0
player stop work month would accept dvd not play refus eject behavior start out intermitt final gave ghost swallow dvd never let go take player apart get dvd out throw player away trash previou dvd player last num year start skip one last less year stop work altogeth wast save time money buy anoth machin,0,1.0,0.0
purchas exact model amazon day ago arriv today noth anywher mac compat no driver cd belkin websit not plug-and-play either appar belkin frequent chang chip manufactur make underli technolog newest card use chip dont mac driver boooi quicksilv g4 os x num2num,0,1.0,0.0
num star durabl num star fun num star educ valu num star overal rate grape whatev color not alter fact delici avail long enough durabl ratingnumwhen certain someon household decor cold cereal seedless grape purchas grape seriou avoc breakfast becom art form quotat eachnumhis/h must properli respect color bowl- add ingredi optim day must part one 's litani thanksgiv saith review mchaiku unusu drab moist autumn day need infus color arch rainbow grape,0,1.0,0.0
tri noodl read articl first magazin women thought great use organ chicken broth carrot satisfi tast ask everyon ... expect pasta substitut not picki grate someth eat that healthi low carb low calori doctor kind food idea happi snackin,0,1.0,0.0
husband drink everi even diner say like desert without calori not drink flavor coffe not like one urg give one tri,0,1.0,0.0
not abl find cooki happi see amazon cooki good great hot tea coffe noth like horribl butter cooki find supermarket drugstor,0,1.0,0.0
buy daughter sinc love drink extrem easi digest better valu cow 's milk.- sa,0,1.0,0.0
one hour teeth much whiter no sensit hour two swollen upper lip last num2 hour approx littl sour kinda like hive give num star love impati want result fast howev next time use go first one one day second hour next day white teeth happi lip normal took num2 hour lol,0,1.0,0.0
ask young femal sale clerk gnc store new protein supplement tast good met-rx respons noth tast good met-rx 'nuf said,0,1.0,0.0
take get use love leav teeth cleaner toothbrush electr ever use feel first like total strang not take time use realiz great concept much faster anyth else.i no buyer remors wish chang brush simpler one brush could share anoth person realli best one per person one sinc chang brush lot hassl,0,1.0,0.0
first wahl massag almost num2 year cord fray great reliabl product two-spe function allow control intens also appreci variou attach allow pinpoint area want work may risk say find multi-purpos massag found mani marvel use money not get anyth better,0,1.0,0.0
want real secret grow hair first need healthi diet includ plenti veget protein protein keep hair scalp clean trim end not use heat applianc time lastli drink water secret go hair care board find peopl swear vivis show pictur pictur person head tilt back make look like hair grew num inch num month not believ nonsens buy vivisc sucker better off take multi-vitamin,0,1.0,0.0
good product surenumi use seventh gener 's laundri deterg pleas review howev cautionari state amazon bottl clean num2 load rate num2 load head note tri notifi amazon system correct inoper moment thu review,0,1.0,0.0
product not certifi harm mercuri distil outnumbi chanc read articl today jan. num2 issu time andrew weil mnumd advis strongli fish oil mercuri free weil also list mercuri free fish speci buy recommend anarct krill oil amazon expens guess throw out almost full bottl natur made read mercuri bad stuff,0,1.0,0.0
far use shaver one month find better true review would take num month use main concern life shave foil remington altough good close shaver shave head disintergr month expens replac,0,1.0,0.0
perfect watch tend not take off much ... work great shower etc also comfort band lightweight not use function much yet also like size readabl display definit great watch cheap price,0,1.0,0.0
wish list decid order christma look store not find anyth look quit arriv say wow nice look substanti size plenti statement pictur not justic say not hesit dissappoint sell out,0,1.0,0.0
love bowl first bowl reach prepar someth kitchen look great big enough serv dip salad etc first fiestawar piec hook collect grow steadili ever sinc easi clean quit durabl no chip scratch yet not care cook great piec incred price,0,1.0,0.0
pleas remov item stock began put togeth immedi cross bar broke without exert part poor product,0,1.0,0.0
someth would alway forget someth need entertain -- ice bucket final rememb get one chose one primarili design *is* love also function conveni dishwash safe ad nice touch recent parti pleas price,0,1.0,0.0
