text,crowd_label,conf0,conf1
num num/num month old babi not walk yet go out put feet without shoe move leg lot usual kick off shoe sock stay better tri not pull off easili hold well wash color match color use babi 's outfit market nice non-slip part print bottom feet say loveabl friend soft rubberish kind print feel nice finger start use babi turn num month old stay well seem like fit anoth month overal nice sock good price highli recommend,0,1.0,0.0
shoe exactli look worri read previou custom review shoe run small/narrow wide foot howev fit perfectli strap feminin gold sole provid enough glitz retail price num3 beat great deal,0,1.0,0.0
first purchas amazon.com thrill first fact found exactli look second came much quicker expect deliveri schedule.thank,0,1.0,0.0
cashmer feel lay like no fabric one cashmer item suggest shawl light weight warm look chic wrap cashmer,0,1.0,0.0
good qualiti jean afford price size right quit comfort,0,1.0,0.0
absolut love panti girlfriend look hot play panti much fun great gif,0,1.0,0.0
use bunch athlet shoe find asic gel nimbu pair pick time light incred 'springi shoe provid right amount cushion much superior opinion nb saucony.th price one thing not happi manufactur term price special shoe,0,1.0,0.0
two packet panti larg also not like cotton sinc open one packet three kept sent unopen packet num back not like themnumjeann allen,0,1.0,0.0
read peopl 's review order littl bag snif arriv certain odor smell believ smell alot like cloth arriv packag oversea etc told last cloth store work smell spray use kill insect like eat materi use cloth purs like not find offens smell disappear overnight.th bag ador chic,0,1.0,0.0
sneaker good look nostalg comfort wear go out night long lasting.i would certainli recommend sneaker,0,1.0,0.0
... would look fine either by-tor snow dog ... highli recommend,0,1.0,0.0
last num week tri not believ,0,1.0,0.0
use avent 1st babi love expect anoth munchkin plan use love love simpl made store milk straight isi pump fridge/freez simpl ye defrost take longer altern alway bottl fridg one defrost found warm boil pot water work best quick defrost take room bag store think convienc outweigh problem store milk fridg freezer learn rotat room not terribl problem import label date contain also save defrost last minut leak issu time time figur out tighten container/bottl much leak simpl fixnumdo not over-tighten avent 's site short troubl shoot list leakag problem tri product avent best famili,0,1.0,0.0
absolut love pump fast effect get way milk pump tri also -- thing expens shop around not overpay got mine privat practic lc add littl love.com got not pump great price owner help issu bottom line pump great someon help support,0,1.0,0.0
bought toy num-month old son grow next year seem offer varieti way learn play put togeth christma morn piec not snap togeth secur kept fall off also one light not work poor construct toy disappoint come fischer-pric return not exchang toy luckili son young enough not miss,0,1.0,0.0
purchas newborn troubl sleep alway woke congest strangl sinc start use wedg not problem num month old,0,1.0,0.0
boy love draw car cup sit kinda pain short drive wonder longer trip,0,1.0,0.0
happi sell outsid gift set.. never lip gloss tast look feel great amber dolli plan tri color best ever tri,0,1.0,0.0
order num2-day suppli murad acn complex -- see alway oili skin littl bump forehead -- biggest problem blackhead cheeks/nos pain red bump alway show shave week acn complex immedi notic reduct post-razor bump well littl red bump forehead refin mask amaz let sit face num2 minut amaz make blackhead disappear plu murad 's formula not dri benzoyl peroxid mean no irrit no dri no bleach collar expens shirt got acn problem owe give acn complex tri,0,1.0,0.0
ok not alreadi awar blot paper mere materi use separ bum public toilet howev not inclin stuff seat cover purs sephora put blot paper mini roller attract light blue contain better packag option small paper offer kleenix-box style sephora 's roll sheet option allow take much need offer effici cut edg easi tear talk,0,1.0,0.0
impress inventiv book children bought book fond want,1,0.0,1.0
absolut love book even though design not much card/invit design typographi graphic element still inspir everyday work make fun coffe tabl book well,1,0.0,1.0
woman cover book look familiar probabl seen one countless fit magazin sport win smile fabul figur use read hardcor fit magazin realiz women featur made work out livesnumand not ever go go far use marvel strict regimin low fat high protein mini meal coupl intens daili workout on-again-off-again raw vegan year use wonder would say strength train raw diet well someon nation fit competitor model person trainer kathi feldman diagnos hypothyroid caus excess weight gain began look new answer diet exercis regimin discov raw food learn no longer over-exercis keep lean strong physiqu kathi recommend num2 raw diet consist fresh juic vitaminer green breakfast follow fresh fruit earli afternoon snack one delici raw crunch bar mid afternoon salad anoth raw crunch bar late afternoon dinner choic cook highli recommend vegan eat not strict bore diet definit appeal averag eater standard american diet sad kathi keep simpl book short sweet explain basic eat raw without get deepli detail nutrit anxiou get straight inform transform bodi background cellular biolog combin easy-go write style make petit diet manual real plu field fit nutrit like fit life help countless peopl chang eat habit back num2 book appeal anyon want transit raw food incorpor raw food diet without go extrem let tell real kicker diet includ raw crunch bar die total addict,1,0.0,1.0
found book full practic guidanc use storytel effect busi set book reinforc mani belief use stori well provid great deal evid effect recommend book wish effect commun busi,1,0.0,1.0
becam engross book minut start read ms.o'connor uncanni knack abl write insight men women grew know intim experi emot passion found deepli root attitud toward theatr toward kept grow chang -- alway wit underneath enorm appeal felt spent mani hour friend care hate finish book..,1,0.0,1.0
wolfgang lotz 's architectur itali num4-num4 wonder introduct survey majesti italian renaiss architectur privilag studi richard tuttl recogn introduct show brillianc lotz 's work well abil show beauti architectur book must seriou academ student architectur enthusiast lotz 's present italian architectur continu ludwig heydenreich 's architectur itali num4-num4 read togeth certainli definit work renaiss architectur marvel pictur diagram best publish imag come across,1,0.0,1.0
inspir book person tri get excit cook two recip fast flavor easy-to-prepar guarante get compliment share also convert serv num peopl author done outstand job come conveni dish not tast way present fun yet stylish format need littl culinari inspir regardless mani serv love book,1,0.0,1.0
problem find word techniqu lovingli effect correct children book younumi becam instant step parent two boy num num part great children time need disciplin loss approach problem book given clear direct tool becom effect parent,1,0.0,1.0
albert goldman author book one level brilliant writer ... ... entir slant toward john lennoni neg ... seem jealou john lennon.. mad jealousi conclus come ... end realli not think consid autobiographi lennon becausewhatev object goldman retain overshadow gross subject gener reason ... bathroom trashi somewhat fiction account john lennon one mostentertain thing ever read ... love john yoko even afterhav read ... make becom obsess myth..,1,0.0,1.0
author continu share us idea dynam color okay use larg floral stripe pattern quilt anoth book awesom beauti quilt make instruct concis easi read templat need complet project includ,1,0.0,1.0
thought book good anderson 's background contribut scholar taught islam law england mani year also take evangel approach help christian tradit background also refut mani better known pluralist hick cantwel etc help averag person better understand whole issu issu extrem import church anderson discuss question christian uniqu one save name jesu forth good book read import subject meati not hard lay peopl read get someth out,1,0.0,1.0
love book spanish much english not lose rythm translat,1,0.0,1.0
month marriag feel suffocated- even though live togeth two year prior make altar not expect miss singl life much go ident crisi book made realiz feel normal not alon island love husband dearli felt guilti feel uneasi book made feel num3 better recommend new bride anyon relish singl life prior settl anyon was/i plain nervou marri book affect marriag better,1,0.0,1.0
feel like scintil dinner convers top player publish industri book firmli ground realiti offer much pseudo- sure-fir formula hit bestsel list -- offer real insight way success flourish book want read glean new piec wisdom time ...,1,0.0,1.0
volum contain except philosoph articl philosophi sartr cover everi aspect life thought critiqu pull no punch omit noth work take hard look sound sartr 's philosophi find out hold read volum p. interview sartr dur later year worth price book alon like sartr love book,1,0.0,1.0
far best book subject one see surf site ca cours sever univers around world import featur book well found exposit book possibl understand design modern comput take decis read processor report everi decis base perform measur good cost-benefit relat book emphas point view everi thing must measur order take right decis also reason sever recent book not bestsel book field time import principl remain howev hope new edit sonner pleas mr. henessi mr. patterson,1,0.0,1.0
book key pass clep us histori exam read cover cover practic test repeatedli got answer correct shortfal book not cover antebellum period level match exam suggest supplement book instantcertnumcom flashcard also use sparknot us histori flashcard timelin end found old high school histori textbook use cement fact learn pay key attent order thing happen intiti certain act movementsnumoveral book must-hav prep pass num2,1,0.0,1.0
thought biographi detail mostli around film page num3 first paragraph think mr. coppola would agre mention fact chief phillip made life last attempt end willard get spear boat kurtz 's mongrul overal book manific biographi itailian-american film maker time,1,0.0,1.0
one awesom follow seri inspector bank book dri season onward one probabl best far.part reason protagonist alan bank got fix pretti good previou book -play fire stori start still recov psycholog physic wound incur previous follow along struggl attempt come back place normal well rebuild home well relationship co-work especi anni cabbot stori forc re-establish re-evalu relationsip younger brother evid relationship hint throughout previou book book place relationship front center.robinson use signatur plot devic dual stori intertwin twin narr wherea previous robinson use devic tell two stori relat philosoph sens time two murder intim relat inextric becom investig robinson build plot line tempo narr brilliantli time littl guard storylin not telegraph end much play fire make much satisfi end particular person favorit out seri far involv mani emot chang charact stori line person bank robinson also start flesh out detect eastval give point view foil strength weak make care lot stori also make stori much complic real,1,0.0,1.0
say book introdouc three charact one chapter charact that entir vocabulari seem consist hotcha gotcha say nearli num2 time chapter would honestli not care peopl up die book no surpris one plot twist obviou num chapter away mention hate annoy underdevelop charact oh ye usual like bruce covil book bought level unread outclass sequel,1,0.0,1.0
purchas book two year ago read not impact much pull out reread deepli move author 's convict spiritu natur life even one strong spiritu convict easi compartment work famili friend spiritu life boll remind integr integr life work although short book not quick read rather someth medit,1,0.0,1.0
great book use daili basi well refer materi w3c elsewher well-organ own previou edit probabl purchas next edit well,1,0.0,1.0
gari smalley obvious horribl husband earli year marriag wonder woman later repent assum women wonder men horribl edit book read relat tell adulter wife affair complet husband 's fault quit frankli offend gari smalley unmitig gall call christian.if wife want find mani way blame problem husband book howev want godli fulfil marriag tri need need willard harley,1,0.0,1.0
num year old son read book num out seven night week pretend boy enjoy differ thing thank book great way show children beauti joy world read book say prayer son start prayer off thank ... quot,1,0.0,1.0
stuck rut work enjoy less found profit drop overhead skyrocket look way live life way want live buy book today today 's difficult invest climat mani us financi advisor trap servic duti administr function make less author live dream enjoy lifestyl deserv show demonstr step-by-step complet specif recommend softwar hardwar technolog improv practic help make money well written extrem interest book give hope vision make chang practic enhanc qualiti life bought book plan spend time condo colorado need idea author deliv exactli need know extra bonu joel terrif respond question email thank gentlemen next book come out,1,0.0,1.0
wonder account euro american transform untam nativ american wilder squar parcel real estat never look fli land way could not put book recommend interest geographi engin histori polit real estat,1,0.0,1.0
bought book husband recent got first violin great use everyday realli easi piec cd help get start,1,0.0,1.0
richard dawkin brilliant write clearli colleagu student learn eas write entertainingli thoroughli enjoy learn process grafen ridley 's compendium scientist benefit dawkin brillianc build work provid import commentari instruct think reason,1,0.0,1.0
jani johnson live nightmar discov kidnap child back birth famili spring move live jani 's whose real name jenni disappear cast shadow everyth jani put back spring traumat find horribl time tri fit sibl angri live dramat chang shock sister thought dead back parent tender cri moment jani want go back old famili old life sibl want reveng jani abl fit hurt famili return peopl think kidnap,1,0.35008898130328564,0.6499110186967143
scientif theori born assumpt bit unconnect evid cement specul associ good bit faith given uncertainti theori made viabl believ not prove today 's lead thinker scienc age certainti repres author 's interview group lead scientist thinker question believ true even though not prove answer amaz not scientist find live engross reflections.dian c. donovan editorcalifornia bookwatch,1,0.0,1.0
consid one best book ever written kebra nagast tell us biblic background rastafari cultur faith read book move taught mani thing rasta belief contain great tale wisdom rasta inform rasta believ book contain inform pass mani gener strongli recommend book rasta person interst rastafari faith,1,0.0,1.0
final ten year teach rcia found book everi teacher 's look unlik materi use author not talk mystagogi better show church father parish priest agre best resourc catechumen candid,1,0.0,1.0
soil organ seldom get due despit fact gain food directli indirectli soil peopl think much exist soil particl fact soil full live thing could almost consid aliv alien spacecraft land almost soil surfac earth would find recogniz life process without much troubl planet may bit weird least weird mar saturn 's moon titan .david w. wolf present readabl fascin view soil biota book tale underground soil microorgan not friendli earthworm prairi dog reader treat broad panorama life suspect number speci soil even rocki crust may larger surfac e. o. wilson said anoth career would ecolog microorgan tropic soil think something.sadli rel soil biologist specialist exampl earthworm creatur darwin note larg respons develop humu temper part world far note ehrenfeld book begin yet crop thu life planet depend soil-form organisms.i visit citru grove florida nearli everi chlorin hydrocarbon known man use against ever present insect pest spooki place soil could use pesticid far could ascertain no ant spider heard no bird sing observ certainli odd everi grove ever visit ant spider common bird song could heard period live creatur found earwig thousand exist leaf litter appar resist ddt chlordan toxophen aldrin dialdrin use grove prolifer beyond belief human activ note wolf need mitig sustain societi not think natur someth conquer last chapter good earth read anyon stake solv problem may lead demis species- mean us still wolf point out condit optimist progress pessimist despair get us nowher patholog optim gotten us point perhap time moder think know may make drastic chang attitud get anywher certainli unfortun sever current govern still patholog optim mode face unpleas fact alway hard howev mani nation intern corpor world bank number insur agenc take threat serious certainli affect drastic chang may of not afford head-in-the-sand think politician seem need get re-elected.read book- chang attitud dirt walk probabl origin,1,0.0,1.0
let see ... betsi ross not make first flag ... georg washington may may not chop cherri tree b thrown coin across river c great leader ... georg bush may may not told lie iraq ... comput programm may may not soul size mouse'snumwhat teach children not believ peopl squabbl whether chief s* *for may may not want use anglic name fact said someth like unlik love vers booknumthi book young children interest present profound beauti word kid along interest pictur might well incit convers buy booknumif want guarante fact read newspap no wait not either read mcse guid cram cours materi rais children think xp good ideanumr folk get life rememb target market book not historian rememb num num year old not subtract larger number smaller one heck read children book talk mice love book five star,1,0.0,1.0
single-volum weighti refer dog expert not miss dog bibl definit sourc thing dog well two hundr breed cover not dog fifti career dog also includ manual health remedi emerg solut groom hint train tip dog 's definit overview includ countri origin altern name characterist chapter cover life dog dog-friendli rental hous cover issu like aris dog ownership especi recommend librari foundat pick,1,0.0,1.0
fianc stay one night read book almost wet bed laugh hard book bring coupl togeth potenti tri time,1,0.0,1.0
blood alon intrest addidt legion seri book honor glori great militari ideal sometim lack today world power like legion damn probabl like book also ... not see would not not wait next..,1,0.0,1.0
book remind porn movi lot sex no plot no charact develop two decid love anyway realli seem know make climax real disappoint like steami sex scene built around charact grow care get know no romanc book,1,0.0,1.0
basic comprehens book process affect coral reef exel edit birkeland includ restpect scientist field book includ plenti refer use need start search topic includ book,1,0.0,1.0
lucki enough live pari young man hemingway wrote wherev go rest life stay pari moveabl feast reason num4 new yorker pari journal columnist adam gopnik wife martha move pari son luke could grow someplac everyth see beauti p. num3 m. f. k. fisher observ book gastronom pari alway seen first time eye childhood love num2 essay journal entri constitut pari moon gopnik 's best write occur describ pari experi young son though whole book may read intim memoir gopnik 's five-year num4-num4 love affair citi light -- caf brasseri shop aesthet carousel luxembourg garden strike contrast stupid barney american televis never-end small moment infus life pari profound mean tryst howev gropnik also learn pari difficult mistress instanc recal frustrat encount upon join french health club attempt purchas thanksgiv turkey num4 strike offer no apolog moon sentiment subject gropnik never lose object journalist 's eye write subject equal funni intellig gopnik 's observ not appeal reader new yorker magazin anyon interest french cultur cuisin bureaucraci g. merritt,1,0.0,1.0
book excel primer anyon interest woodwork handtool clear illustr identifi tool particular correct usag mainten woodwork handtool handplan screwdriv includ also includ appendix list essenti handtool woodshop found appendix book indispens,1,0.0,1.0
practic num2 year treat adult children alik read mani book subject add adhd frankli found book full old sham treatment not work better snake oilnumthi guy snake oil salesman dr stanley j. steinberg dnumc,1,0.0,1.0
alway want japanes garden whenev bought book subject complic complex understand takashi sawano manag write book us not born garden easi understand fabul japanes garden friend rave realli not recommend book enough want authent japanes garden look like straight out japan buy book,1,0.0,1.0
behind scene stori mr. mill tell player tradit wimbledon long illustri career amaz deep background insight person like jonhni mac even british restraint tell think jimbo big bulli us wonder say winner even deepli felt loser championship get read here.h share insight reason behind declin british tennis.i alway thought one proverbi british gentlemen not disappointed.a must read tenni fan,1,0.0,1.0
read book 1st time right becam new christian almost num2 year ago chang life titl melodi use book perfectli describ keith green 's heart made mani mistak often zealou faith inspir complet trust god cost gave opportun rich famou accord world 's standard turn becam rich famou accord god 's standard recent read book cri hard could not breath not much keith famili wish even fraction faith zeal keith,1,0.0,1.0
book must big thank scott write knew scratch surfac soundforg 's power book reaffirm book eclips geniu softwar niic,1,0.0,1.0
first start read book thought good lack littl detail skim part discuss variou event band experienc first thought much written read appear author either not research not enough come kurt 's experi courtney no mention made courtney 's action leav reader believ kurt alway fault also gloss heartbreak kurt suffer franc taken away went get back consid impact three lack inform question best also never mention fact doctor treat kurt rome incid said no evid kurt swallow let alon num2 rohynol simpli goe courtney 's comment around event come kurt 's death not author alway refer suicid not num3 proven mani peopl get 'fact wrong kurt not disfigur badli could identifi fingerprint not barricad greenhous stool front back door no way gain entri balconi small barstool could not block anyth even someon could scale balconi kurt 's wallet not lie open next bodi policeman state open wallet put take pictur also wendi not make miss person 's polic report courtney admit call polic pretend wendi author state wendi courtney krist decid kurt 's ash would spread far anyon know besid courtney kurt 's ash made sever tsatsa monk ithaca ny buri tree lake washington hous accord courtney allegedli spread wishkah river no one realli know happen kurt 's ash except courtney one look item author either not includ made major mistak make hard take rest book truth good read least first part mani book out kurt much better,1,0.0,1.0
first not let book make decid rest seri suppos long version romero 's dawn dead zombi rule stori take twist turn stori take look human aspect zombi outbreak peopl deal situat aris great case studi human relationship strain constant tragedi friend borrow gotten becom addict great seri,1,0.0,1.0
mass affluenc complement dollar disciplin fox gregori explain emot need today 's mass-market custom end-us broadcast custom put two togeth see product develop sale work come decad review base read commerci execut summari book,1,0.0,1.0
ream ream invest valuat book market -- obviousnumin opinion three no one without appli equiti analysi stephen penman 's monster tome financi statement ... lastli aswath damadoran 's book invest valuat hyperventil mba default damadoran realli enjoy simplic behind appli equiti analysisnumcaut neither num would call light read money left honor mention goe cook 's secur analysi wall street,1,0.0,1.0
easili access short reason thorough introduct subject risk author touch almost everi dimens topic includ financi risk oper risk reput risk govern risk even risk terrorist attack book might quit bit shorter somewhat focus corpor manag author kpmg vice chair mari pat mccarthi timothi p. flynn tighten anecdot anti-terrorist prepar olymp game howev seem believ would lose reader unless provid entertain distract could right though break littl new ground plow old ground interestingli recommend portabl summari use inform ceo board member intend audienc well anyon respons risk manag,1,0.0,1.0
