text,crowd_label,conf0,conf1
cfa candid also hold mba thi requir book wonder written practicion strong conceptu technic framework learn lot global financ teach concept lo well defin concept tool wealth problem solut direct relev theori practic great success plu prof solnik regard star research also among major global asset manag pension fund help lot cfa exam far superior prep school also current job asset manag not resal,1,6.174010448860441e-65,1.0
allright listen break countri simpl littl actual literatur world not recogn peopl set arbit literari art no discern bad intellectu charact easili bamboozl write reflect dishonesti narciss cobroc mcgonigl whatev name one writer ballyhoo sky tast fraud not tell make good write make bad write not tell differ sucker pretenti narcissist phrase-mak word molest like exampl invent new word like candleflam churn out lot copi pretenti asinin titl like pretti hors kind titl teenag no talent write come process get f high school creativ write basic peopl not see william faken unabl see comrod mcdougal william faken may well reincarn copran mcviegl wrote exact type tripe complet pretenti meaningless titl like intrud dust intrud dust late oh forgot not enough swing hip literari fast set know fast set compos not compris pretenti mis-usag middle-ag women vagu rather humbl pretent art appreci join promulg book club know dumb get stuff great not know actual smart enough see emperor no cloth,1,0.0,1.0
start play piano oldi singer num2 stuff come out book num3 song not possibl cover everyth song chosen well chord interest not vanilla major/minor/7th get book although song chord clearli wrong avoid sight-read job singer own extra copi book share accompanist like much bought one may even get rock band buy copi play dinner music parti get go even bb eb version sax player not get much better,1,0.0,1.0
bought three guid start privat practic one outshin everyth need noth not inform set fee specif help unlik mani book give gener overview even small thing like busi card stationari discuss market idea great well,1,0.0,1.0
three volum purchas start famili chicken flock far use highli recommend begin intermedi chicken farmer,0,1.0,1.2294797597946618e-22
not total beginn though author recommend gentoo setup,0,1.0,0.0
book well research extrem poorli written driest bore histori book ever read life entir thing present simpl collect fact author hardli give insight major charact realli like sometim get littl glimps footnot bought book see good review gotten troubl focus read num2 minut feel like wast time read tediou amass factual evid,1,0.0,1.0
consult career work lot model valu candid restructur debt perform due dilig etc main problem alway found difficult get good refer book valuat book give basic dcf treat valuat straightforward manner arzac 's book hand treat valuat practic theoret perspect support research evid found book help contain differ type valuat tool arrang commonli found practic i.e adjust present valu earnout origin issu discount synergi scenario analysi conting claus entri foothold exit option etc engin train found technic note end book handi addit cd accompani arzac 's textbook use provid mani essenti valuat tool option price debt capac calcul etc highli recommend book anyon seriou interest corpor financ consult invest bankin,1,0.0,1.0
sinc current particip neophyt grade golden dawn purchas text supplement studi regimen disagr among proctor regard proprieti cicero 's part make inform outer grade avail immens valuabl secondari resourc cicero basic done noth inflammatori regardi public golden dawn mani year ago basic inform variou grade lectur intact also differ perspect point view well time inform present exampl latter mean associ tarot card present part philosophu grade wherea one actual expos materi neophyt zelat grade actual golden dawn howev must concur self-initi golden dawn oner not imposs task like write text self admiss studi harvard mba such-lik not part golden dawn without intiat golden dawn not way think religi belief one associ simpli like mind establish magick order appreci membership one must join much simpler follow book first order actual quit easi contact gener welcom everyon least earli grade second cours studi difficult enough initiatori experi proscrib book much templ far complic beginn success perform complet omit astral essenti benefit perform ordain initi golden dawn believ much simpler pay num3 per year go initiatori experi within templ well dedic instructor/proctor quiz materi would spend least amount money implement requir one initiatori ritual includ within text final organ golden dawn templ would like refus admit recogn work done actual take plung join even would requir pass variou grade no advanc placement credit allow afraid one look cours magick base golden dawn system magick modern magick dm kraig still stand one best one want part golden dawn join easi buy book supplement order 's alreadi phenomen cours materi,1,0.0,1.0
book 's approach intuit almost lead hand world jazz certainli jazz freedom express know book tool combin tune mix listen world jazz open standard everi high school jazz program everi colleg lab band,1,0.0,1.0
favorit birthday present not laugh till almost wet food wonder good thing book regardless titl make sound not christma book rather book cover holiday even not cook still fall love rubi ann friend high chaparr trailer park realli way make forget troubl went out bought first book readi time fall love peopl book she come stori never know hope continu write talk war need escap world live keep great work rubi ann boxcar,1,0.0,1.0
epstein expertli cull avail documentari evid includ contemporari account well sourc runaway slave notic mention slave question fiddler fill lot gap knowledg african music develop transplant north america book well-written full groundbreak research absolut essenti interest subject,1,0.0,1.0
handi book liter thousand convers look unit convert metric convert metric unit unit unit identifi countri origin includ ancient greec rome egypt china etc,1,0.0,1.0
absolut great book enjoy especi brother capt bill morgan serv major leonard clark author oper canari small group oss personnel flown formosa end wwii accept surrend gener ando num3 num3 japanes troop brother highest regard major clark major clark went back china brother took command oper canari major clark invit brother join explor activ wwii unabl join famili respons nevertheless maintain contact len clark len 's untim death upper amazon result two arrow back clark great explor author wish still aliv could shake hand sit listen tell stori life arthur t. morga,1,0.0,1.0
mexican food absolut sacr book profan bought spend year mexico want recaptur tast came love much big dissapoint understand might neat stori went not know spanish still learn cook thing ... howev outsid perspect come across irrit ignor method anecdot opposs research recip stori manag miss grace high class mexican cuisin flair mexico bounti street food cultur diana kennedi rick bayless name two famou book english thought authorit even quick glanc one far superior book expos ortiz 's attempt exercis vain superful,1,0.0,1.0
power littl book interest teacher colleg guidanc counselor curriculum director luck would teacher curriculum coordin human depart school teach senior english first time year initi convers across grade level num-num2 regard dearth assign includ narr write import term develop critic set writerli skill particular colleg essay mari jane reed 's book becam avail reed address concern rais see connect see extend provid power tool teacher student essenti arena reed 's goal help teacher guidanc offic help student write power colleg essay point out import way write think often overlook across curriculum know true school work senior student year creat portfolio colleg essay authent meaning scholarli activ meant student point academ career exercis open door discuss write write particular never experienc year teach grade num num2 colleg composit delight find grow awar concern mirror meticul craft littl book high school teacher crave practic advic applic find along compact disc fill materi use handout transpar finish gave copi guidanc depart order copi grade level team cindi sabik gilmour academi gate mill ohi,1,0.0,1.0
hopeless town alway burn doctrow 's novel sleek power not american stori stori societi build break dirti natur human soul littl spot light tri burn bright stori democrat mass danger philosoph king not power aught bad man bodi like lord fli not alway wait ride mountain resid everi human heart still essenti american novel pay particular interest deconstruct myth american west kind anit-shan,1,0.0,1.0
loui armstrong one central figur along duke ellington giddin 's incred vision jazz sent satchmo mindblow collect photograph biograph music discuss bring man work life although giddin cover ground vision far expans studi built idea armstrong great artist great entertain role one area not diminish role pictur remark numer excerp armstrong 's write show decent joy man highli recommend,1,0.0,1.0
move lake counti began studi write clive matson chang life not write life life year achiev dream publish first book sightlin poet 's diari acknowledg say thank clive matson said could heart let crazi child write find creativ write voic let writer human be know beat within heart need need come out heard continu stand origin review post num4 let crazi child write touchston write booknumjanet grace riehl author sightlin poet 's diari,1,0.0,1.0
book wish child mother child featur stori beauti illustr like intellig convers improp touch whether not sexual.th book respect reader intellig use proper terminolog genitalia gener term bottom mean buttock like mani work weaken silli euphemist babyish name anatomi nobodi real servic book good teach tool excel forum discuss seriou topic one age would find benefici anoth review made good point boy also sexual abus never address book agre alreadi excel work would even effect discuss includ brother part discuss natur want preserv child 's innoc still vital empow children inform constitut desir non-sexu good touch not turn help famili build safety-savvi world.thi book excel job defin privaci replet exampl e.g privat part part one 's bodi gener cover underwear bath suit girl featur stori declar nobodi touch privat part way not want goe describ kind touch not like sit uncl 's lap flip side good touch highlight love cuddl danc arm around shoulder distinct could not clear salut book gray area tickl explor tickl fun also go far one tickl not enjoy anoth exampl demand certain touch tactil activ stop children well within right time hug kiss describ gener welcom accept children not forc kiss endur kiss someon make feel uncomfort literari mother wise make plain daughter child 's feel paramount not worri hurt somebodi 's feel tell not touch way not like genit touch includ forc touch someon els 's privat part discuss girl also told not take photograph somebodi 's privat part willingli allow anyon photograph favorit part mother tell daughter predat not alway stranger someon child know well includ rel point not stress enough child told tri escap soon possibl tell adult trust happen agre anoth review dearth stori like boy boy also recipi sexual abus sinc girl brother one wonder not includ safeti talk sinc part discuss involv safeti consid well anoth good point made mother tell daughter never accept children oppos older children could mislead thing notwithstand feel one best book encount seriou subject.i also recommend sandi kleven 's right touch read aloud help prevent child sexual abus cornelia spelman 's bodi belong ideal preschool set peter alsop 's collect song sex sexual particularli song bodi work address seriou issu gentl direct intellig compliment way gear specif famili,1,0.0,1.0
receiv book gift first came out alway admir great presid not read anyth els lincoln prior book found could not put done read like num day almost would describ book pictur album full snapsnot taken lincoln 's friend famili acquaint write review nearli num year later pick read recent lincoln program pb air televis fell love book man one not histori polit buff admir treasur small book,1,0.0,1.0
first differ label get confus lay-person found dr simon 's analysi manipul charact person illumin relationship manipul partner made mistak come classic model defenc system develop sens conscienc etc stymi could not understand action relat profess believ etc thank dr simon share work us also believ extrem danger approach disturb charact classic psycholog model realli enabl hijack servic keep manipul not help societi manipul one bit hope convinc contemporari psycholog field take board find believ would revolutionis legal child protect field thank you.margaret-ann colemanaustralia,1,0.0,1.0
simpli bore uninterest book ever printedinot fault editor way book govern document although wonder window english histori heritag properti right book terribl bore epic viciou account noth expect record everi minor person land ownership england import piec western heritag mayb not bed time read five star translat beauty/present,1,0.0,1.0
enjoy mani book mr. beevor one well-written inforn other everyon know least way stori wwii occup pari us not know happen citi franc liber book fill gap knowledg quit well show franc realli front line cold war latter part num4 's read humanitarian gener contribut us initi recoveri franc leadership strove mightli regain stabl govern time tri best overcom stigma vichi amaz lack gratitud among french us done num2th centuri book show no good deed goe unpunish,1,0.0,1.0
not know better would swear book written satanist author seem rejoic prospect armageddon includ mountain blown destruct world 's citi bought tatti copi one penni somewhat surpris see num4 num2th print seem reason assum mr lindsey 's view fairli repres mainstream america case suggest plenti american keen armageddon erupt middl east good christian may whisk off privat audienc j. christ rest popul burn would recommend book isra book last day israel zionist author barri chamish declar israel 's main enemi european socialist well reckon hal lindsey fan present greater threat seem like suppos templ solomon not rebuilt israel not annihil lot commit christian go upset bit good news lindsey 's book surviv isra convert christian passion like num3 num3 billi graham seem commit christian charg uk us govern us govern could describ theocraci wonder theocrat share view mr lindsey state book arab gener hate israel one would good news would mean would like attack initi armageddon caus return jesu christnumrussia portray villain book red china red chines get look-in chapter entitl yellow peril book howev contain one true statement page num3 religion great blinder mind men frankli hope raptur happen soon sooner peopl like hal lindsey whisk off face earth greater likelihood peac world,1,0.0,1.0
book tri say back injuri stress dont think herniat disc annular tear heal coupl week social secur doctor recommend read even though injur hernaiton annual tear even though awar injuri still must think stress relat joke book stink,1,0.0,1.0
dog daycar blueprint success easy-to-us guid lifestyl oblig dog daycar servic owner dog daycar present user-friendli introduct explor everyth necessari get start reader discov understand basic gener inform need start dog daycar includ licens zone guidanc legal financi insur concern daycar owner form record-keep materi need oper daycar provid safe stimul environ keep dog healthi happi option money-mak servic daycar center may provid troubleshoot idea deal aggress dog 's owner expuls issu monitor relationship certain group dog identifi control measur use maintain stabil dog daycar strongli recommend aspir dog daycar owner well gener dog owner seek good day care arrang anim companion,1,0.0,1.0
start suggest process revamp establish one book read appli robinson schroeder boil thousand page materi year research subject num3 readabl page,1,0.0,1.0
john ahart 's director 's eye comprehens text director actor intend student audienc contain practic inform repres half-centuri experi teach direct contain thirti chapter everyth impart style content play special challeng comedi format 'must aspir director,1,0.0,1.0
found immens enjoy along midnight silent speaker villian plot consid one best classic wolf goodwin,1,9.447551162325491e-203,1.0
u love adventur suspens ... u got ta read book wut realli made wan na read book.. more.. listenin record messag immagr suddenli voic start talkin ... like u actual hear ur head cool couldnt wait finish book see wut happen unfortanantli u got ta read book cuz im not tellin u. so.. read,1,0.0,1.0
first unix book bought love lot teach fundament use oper system desktop refer command utilit term refer book year get robust amount inform unix dollar,1,0.0,1.0
finish book hour ago readi rave gener highli visual access approach popular scienc book ever read quickli took unpreced comfort level materi cellular biolog three-dimension domain pure-text approach fall short tri describ spatial process cellular replic dna copi etc think write team talent make inform teachabl book along book kind seri great gift curiou layperson thank author wow,1,0.0,1.0
book blew mind..th write clear idea excit thought would summer read done week -- could not put book give weight psycholog histor philisoph sociolog aspect subject balanc well present format delight read..complex without dri minut highli recommend book,1,0.0,1.0
great subway map not forget read sign subway train run certain days/tim rememb correctli path not realli book,1,0.0,1.0
extrem well-docu fact-fil book expos deplor condit public school system not see anyon argu fact -- -the book load quot educatin system excerpt public school book curriculum site sourc highli recommend itnumin fact loan copi out least num2 peopl everi one without except love booknummost purchas copi read mine inform contain book scare especi children public school unfortun parent no idea realli go child 's school -- -thi book wake-up call begin read not abl put,1,0.0,1.0
recommend book anyon come dispens background interest eschatolog end-tim well written short chapter not bog reader difficult theolog jargon expos reader historicist typic seventh day adventist interpret end-tim scriptur challeng dig deeper word god critic eye,1,0.0,1.0
not like advic chang outlook found research fascin definit worth read,1,0.0,1.0
review buyer bewar raw meat kill ... review shani like not read book kliment say not drink raw milk rather look organ milk safe pasteur differ techniqu retain import enzym write milk raw p num2-num2 common physician earli part twentieth centuri use raw milk butter made raw milk therapeut purpos ... feder state law requir pasteur dairi product howev make raw milk almost imposs come agribusi dairi heat milk num3 degre loui pasteur discov milk heat num3 degre one-half hour enough kill bacteria purpos boil milk num3 degre not keep public safe bacteria caus diseas extend shelf life product ... buy brand organ milk call organ life not heat high tempertur enzym destroy spoil two day not use brand milk seem last forev refriger even label organ avoid kliment address raw food meat egg ... safe insight manner discuss milk even improperli balanc vegetarian diet potenti lead degen diseas kliment discuss diet well provid mani safe effect dietari plansnumther mani differ dietari recommend book one not suit style other equal effectivenumberth gerard,1,0.0,1.0
thank patti davi beauti help book caregiv husband midway alzheim read book subject look help best patti gave best inform help one long ordeal would recommend heart warm book everi caregiv world sure wish could thank ms. davi person lorin roh,1,0.0,1.0
bit histor true crime buff even blog subject leap bound best histor true crime book read top notch research tell reader mentioned-y not forget book horror sister endured.a good good fiction novel starvat height not miss,1,0.0,1.0
veteran commun life num2 's truli appreci authent -- pure fun -- iri keltz 's book photo articl memoir hippi artwork take right spirit time great trip,1,0.0,1.0
fiend mine studin judaism ask buy book bein not xpert field pop 'd book loox like ultim reffer topix yur lookin guid topic yur pick,1,0.0,1.0
book look ador borrow librari pre-read share num year old daughter good thing end littl girl say allow say thing realli not mean sorri horribl lesson teach rememb kid get out anyth fake remors lie love one parent forewarnednumit not book moral may even negat tri teach,1,0.0,1.0
divid hous gender civil war collect essay pertain crisi gender relat accompani civil war america collect essay present narr chronicl variou impact gender affect men women north south well slave non-slav emerg cohes bodi text inform illumin instruct theme explor volum empower abolition civil war crisi gender relat leann white two group percept gender crisi northern feminist black abolitionist civil war public statu motherhood increas lead anoth theme later explor follow essay state famili first essay leann white argu civil war creat circumst gender equal diminish white southern male masculin increas black manhood idea manhood civil war investig part ii reid mitchel 's soldier manhood come age northern volunt journey civilian soldier mirror transit boyhood manhood constitut manhood evolv delic balanc masculin manli restraint civil war bodi polit well armi assum famili tie facilit solidar despit chang notion manhood black male popul empower not alway benefici jim cullen 's gender african-american men detail concept black manhood chang civil war masteri one 's bodi lead masteri warfar despit place danger front black soldier endur low pay high diseas exchang masteri bodi part iii divid hous gender civil war theme move issu manhood relat women arrang doll 's hous refin women union nurs author kristi ross write femal volunt hospit transport draw famili theme present hospit transport rearrang doll 's hous appear domest ross also reveal sens agenc women volunt claim mani felt ... eager seiz occas escap routin pattern live familiar genteel standard household organ num3 lyde cullen sizer 's act part narr union women spi also deal issu femal agenc civil war sizer examin repercuss women felt depend whether white black white women spi effort dramat substanti wherea black abolitionist like harriet tubman caus consequ spi much realist sizer 's essay also attempt place femal spi narr literari context exclud essay divid hous none color titil michael fellman 's women guerrilla warfar dramat prose fellman explor peacetim moral subvert guerrilla warfar male guerrilla fighter attack tradit valu physic attack women fellman doubtless present form psycholog histori claim also addit element bad boy act out against nag smother mother num3 mani kansa guerrilla regiment civil war free slave act defianc rather moralist pursuit guerrilla warfar final reinforc need love secur famili fourth part divid hous close examin dynam southern homefront peter bardaglio 's children jubile african-american childhood wartim explain prior civil war slave children age-segreg not gender-segreg freedom concept first emerg mani slave civil war play activ among children becam gender martha hode 's wartim dialogu illicit sex white women black men draw theme black male power polit issu emerg civil war consequ led sexual becom polit issu yeoman farmer war homefront becam locat illicit sex well perform stage class discord southern state not one feel impact gender relat civil war creat part v examin gender issu northern homefront patricia r. hill 's write out war harriet beecher stow 's avert gaze part vi essay examin polit reconstruct becam gender northern women begin campaign vote new labor opportun african-american men women spite advanc howev rule class south still attempt exert author black women still subject southern white male violenc evidenc catherin clinton 's conclud essay reconstruct freedwomen divid hous gender civil war combin variou historiograph methodolog cultur social psycholog intellectu polit simultan present coher evoc studi wartim 's affect gender relat addit map theme gender relat war narr women 's undertak profession manageri duti men fight civil war provid histor anchor theme femal labor aris first especi second world war,1,0.0,1.0
anoth book write well need ask answer anyon want write better want better writer must continu practic skill sure could probabl improv style without book not learn trick trade especi enjoy rewrit exampl rewrit histori particularli interest expend bit energi read studi ryan 's book expect write bit eas someon comment even good writer need perpetu reassur write corpor ladder reassur,1,0.0,1.0
one beauti well done book look read indulg wright wonder photographi inerest write mani author lore wright.a great gift someon interest fllw,1,0.0,1.0
